p,post1,post2,true_label,matched_rules,matched_behaviours,pred_rule_based,category_counts,score_rules
30,"What a weekend we have just had catching up with my childhood friends. The sun made a special appearance for us and it felt like the gods were looking out for us!

We ate, drank, laughed and shopped our hearts out.

Thank you for this special time together and can’t wait to do this again ????????","Happy birthday to you, my wonderful husband. Can’t wait to shower you with your gifts and take you out and celebrate you. We will go to your favourite restaurant ??

Congratulations ?? on this your special birthday ?? ?? let’s have lots of funnnnn!!

Love you very much, see you later my darling xxxxx",Low,"['IF a person shows in a post expressions of gratitude for friendships and excitement to reconnect, THEN extraversion is likely High because it reflects enthusiasm for social interactions and relationships.', 'IF a person shows in a post enjoyment and eagerness about future social events or gatherings, THEN extraversion is likely High because it highlights a desire for social engagement and connection.', 'IF a person shows in a post enjoyment in sharing humorous and fun experiences with friends, THEN extraversion is likely High because it indicates a lively social engagement.', 'IF a person shows in a post eagerness to make future plans with people, THEN extraversion is likely High because it illustrates a proactive approach to socialization.']","['Thank you for this special time together and can’t wait to do this again.', 'Can’t wait to shower you with your gifts and take you out and celebrate you.', 'We ate, drank, laughed and shopped our hearts out.', 'let’s have lots of funnnnn!!']",High,"{'Warmth': 1, 'Energy/Activity': 1, 'Positive Emotions': 1, 'Sociability': 1}",0
31,Long awaited catch up with life long friends!  Why has it taken so long? It was so good to catch up with everybody.  It has been so great seeing how we have all changed and grown both physically and spiritually.  Let me know who is up for making this an annual event? Please let me know.  I am happy to organise it.  Feeling blessed.  Cheers everyone!,"Happy birthday to the best and most wonderful husband I could ever ask for xx  Thank you for everything you do. Thank you for being an awesome dad to our two children. Enjoy your day and look forward the birthday celebrations tonight.  Enjoy your gifts. 
 You  so deserve them.  Love as always.",High,"['IF a person shows in a post expressions of gratitude for friendships and excitement to reconnect, THEN extraversion is likely High because it reflects enthusiasm for social interactions and relationships.', 'IF a person shows in a post enjoyment and eagerness about future social events or gatherings, THEN extraversion is likely High because it highlights a desire for social engagement and connection.', 'IF a person shows in a post enjoyment in sharing humorous and fun experiences with friends, THEN extraversion is likely High because it indicates a lively social engagement.', 'IF a person shows in a post eagerness to make future plans with people, THEN extraversion is likely High because it illustrates a proactive approach to socialization.', 'IF a person shows in a post minimal enthusiasm or excited language when discussing social gatherings, THEN extraversion is likely Low because it reflects a lack of energetic engagement.']","['It was so good to catch up with everybody.', 'Let me know who is up for making this an annual event? Please let me know. I am happy to organise it.', 'Long awaited catch up with life long friends!', 'Let me know who is up for making this an annual event?', 'Happy birthday to the best and most wonderful husband I could ever ask for xx Thank you for everything you do.']",High,"{'Warmth': 1, 'Energy/Activity': 2, 'Positive Emotions': 1, 'Sociability': 1}",1
33,Back with the besties! Hanging with my buds from grade school… can’t believe how long it’s been. After all this time they all still get it. Anyone who want to get a drink come on by. High school may have been fifteen years ago but it still feels like we graduated just yesterday. ,Happy birthday to my best friend and partner in crime. It’s crazy all we’ve been through in the past fifteen years. Through all the ups and downs you have always been there for me. I couldn’t ask for a better person to share my life with. Happy birthday and here’s to the next decade together. ,Low,"['IF a person shows in a post expressions of gratitude for friendships and excitement to reconnect, THEN extraversion is likely High because it reflects enthusiasm for social interactions and relationships.', 'IF a person shows in a post enjoyment and eagerness about future social events or gatherings, THEN extraversion is likely High because it highlights a desire for social engagement and connection.', 'IF a person shows in a post a focus on collective experiences and shared enjoyment, THEN extraversion is likely High because it emphasizes a desire for communal activities and friendships.']","['Happy birthday to my best friend and partner in crime. It’s crazy all we’ve been through in the past fifteen years.', 'Anyone who want to get a drink come on by.', 'Back with the besties! Hanging with my buds from grade school.']",High,"{'Warmth': 1, 'Energy/Activity': 1, 'Sociability': 1}",0
35,Had a great catchup with my old friends today. It had been too long since we had last spoke with each other. Met up at a local pub and had some nice drinks and a great dinner. There was a show on across the road and we jumped over there after a few beers. Thanks for organising it guys and let's not wait too long for the next one! ,"Happy birthday, babe! Where has the year gone? It felt like only last month we were talking about our plans for the year and now nearly a whole other year has gone by. Don't feel too worked up about your age because I know it gets to you, sometimes. We'll go out and enjoy ourselves and treat it like an 18th to make you happy. Remember, it's better to be over the hill than buried under it.",High,"['IF a person shows in a post expressions of gratitude for friendships and excitement to reconnect, THEN extraversion is likely High because it reflects enthusiasm for social interactions and relationships.', 'IF a person shows in a post enjoyment and eagerness about future social events or gatherings, THEN extraversion is likely High because it highlights a desire for social engagement and connection.', 'IF a person shows in a post a focus on collective experiences and shared enjoyment, THEN extraversion is likely High because it emphasizes a desire for communal activities and friendships.']","[""Thanks for organising it guys and let's not wait too long for the next one!"", ""We'll go out and enjoy ourselves and treat it like an 18th to make you happy."", 'Had a great catchup with my old friends today.']",High,"{'Warmth': 1, 'Energy/Activity': 1, 'Sociability': 1}",1
39,"Had an amazing night catching up with my childhood friends! It’s been way too long since we all got together. We reminisced about our wild adventures and laughed until our sides hurt. It’s crazy how some things never change, like our inside jokes and silly stories. Grateful for these friendships that stand the test of time! Can’t wait for the next reunion!","
Happy birthday to the love of my life! You bring so much joy and laughter into my world, and I’m endlessly grateful for every moment we share. Your kindness, strength, and passion inspire me every day. Here’s to celebrating you today and all the amazing adventures ahead! Can’t wait to spoil you and make this day unforgettable. Love you to the moon and back!",Moderate,"['IF a person shows in a post expressions of gratitude for friendships and excitement to reconnect, THEN extraversion is likely High because it reflects enthusiasm for social interactions and relationships.', 'IF a person shows in a post enjoyment about future social events or gatherings, THEN extraversion is likely High because it highlights a desire for social engagement and connection.', 'IF a person shows in a post enjoyment in sharing humorous and fun experiences with friends, THEN extraversion is likely High because it indicates a lively social engagement.', 'IF a person shows in a post eagerness to make future plans with people, THEN extraversion is likely High because it illustrates a proactive approach to socialization.', 'IF a person shows in a post a focus on collective experiences and shared enjoyment, THEN extraversion is likely High because it emphasizes a desire for communal activities and friendships.']","['Grateful for these friendships that stand the test of time! Can’t wait for the next reunion!', 'Can’t wait for the next reunion!', 'We reminisced about our wild adventures and laughed until our sides hurt.', 'Can’t wait to spoil you and make this day unforgettable.', 'Had an amazing night catching up with my childhood friends!']",High,"{'Warmth': 1, 'Uncategorized': 1, 'Positive Emotions': 1, 'Sociability': 2}",0
40,had fun today! got to see my friends that i've grown up with. im grateful to go through life with them and to see them grow as people. every accomplishment i will be there for becauase i know they will be there for me. i am truly grateful to have such a strong group of people around me and to uplift me.,"happy birthday my love. i am so proud of you. you are my best friend, my ace, my rock. i love you more than every. you keep me on my feet and you never let my crown tip. even trhrough all the trials and tribulations. i am lucky to have someone like you in my corner. you never fail to make me happt",Moderate,"['IF a person shows in a post expressions of gratitude for friendships and excitement to reconnect, THEN extraversion is likely High because it reflects enthusiasm for social interactions and relationships.', 'IF a person shows in a post enjoyment and eagerness about future social events or gatherings, THEN extraversion is likely High because it highlights a desire for social engagement and connection.', 'IF a person shows in a post a focus on collective experiences and shared enjoyment, THEN extraversion is likely High because it emphasizes a desire for communal activities and friendships.', 'IF a person shows in a post a focus on deep emotional connections over social activities, THEN extraversion is likely Low because it indicates a preference for intimate, rather than group interactions.']","['i am truly grateful to have such a strong group of people around me and to uplift me.', 'i will be there for every accomplishment i know they will be there for me.', ""i've grown up with my friends... grateful to go through life with them."", 'you are my best friend, my ace, my rock.']",High,"{'Warmth': 1, 'Energy/Activity': 1, 'Sociability': 2}",0
44,"How time surely flies meeting up with my old class for 08” has brought back so many good memories and some much nostalgia but glad today we are here together again and making more new memories. Growing up we always talked about this moment and how memorable it would be to be able to actually do after 10 years feels so surreal, am glad we meet so many years ago wouldn’t ask for more # when friends become family ????",when we meet online a few ago i never would imagined we would be celebrating your 34th  birthday together in this moment. I wish you many more birthdays ahead and wanted to let you know you are truly loved and appreciated everyday you bring love and warmth into our lives i could not ask for more. Many this birthday be everything you wish for and more and hope you age gracefully and we will celebrate many more birthdays together ??????????,Low,"['IF a person shows in a post a tendency to reminisce about past experiences rather than emphasize current engagements, THEN extraversion is likely Low because it suggests a preference for reflection over active social participation.', 'IF a person shows in a post feelings of nostalgia without present action, THEN extraversion is likely Low because it suggests reflection without current social motivation.', 'IF a person shows in a post a focus on deep emotional connections over social activities, THEN extraversion is likely Low because it indicates a preference for intimate, rather than group interactions.']","['How time surely flies meeting up with my old class for 08” has brought back so many good memories and some much nostalgia...', 'Growing up we always talked about this moment and how memorable it would be to be able to actually do after 10 years feels so surreal...', 'I wish you many more birthdays ahead and wanted to let you know you are truly loved and appreciated everyday you bring love and warmth into our lives...']",Low,{'Sociability': 3},1
46,"Such a crazy time with my bro from childhood. We got to this house party which was full of vibes. From the time we got there we knew it was going to be special. The decoration on the house was amazing. Massive shout out to whoever made the ribs, chicken wings and burgers - 10/10. Music was on point, dancing was on point too. We need to do this again.","Just want to send a special happy birthday to my wife - my best friend, my advisor, my partner in crime and in love. Your patience, kind heart, focus, intelligence and your resilience in the face of life's obstacles makes me so lucky to be called your husband. To witness and stand by the woman you've grown into is amazing. I look forward to celebrating many more birthdays with you. Happy birthday my love. ",Moderate,"['IF a person shows in a post enjoyment and eagerness about future social events or gatherings, THEN extraversion is likely High because it highlights a desire for social engagement and connection.', 'IF a person shows in a post a willingness to engage and perform actions to get the attention of others, THEN extraversion is likely High because it indicates an outgoing and sociable nature.', 'IF a person shows in a post expressions of gratitude for friendships and excitement to reconnect, THEN extraversion is likely High because it reflects enthusiasm for social interactions and relationships.', 'IF a person shows in a post a focus on collective experiences and shared enjoyment, THEN extraversion is likely High because it emphasizes a desire for communal activities and friendships.']","['We need to do this again.', 'Massive shout out to whoever made the ribs, chicken wings and burgers - 10/10.', 'Just want to send a special happy birthday to my wife - my best friend, my advisor, my partner in crime and in love.', 'Such a crazy time with my bro from childhood. We got to this house party which was full of vibes.']",High,"{'Energy/Activity': 1, 'Sociability': 2, 'Warmth': 1}",0
47,I am really happy I attended this event as it really exposed me to a lot of persons I have not seen for a while. I was able to catch on things I have missed about my guys and reconnecting with them really gladdens my heart. I will quickly connect them on all social media network to sustain the relationship so as not to lose. Thank you guys.,"A superlative birthday shout out to my you my guy!
You have really done well in your career and I am so happy for you on this special occassion of yours. The Lord bless you real good brother.
I would have come around to say hello, but I am really busy right now.
Enjoy your day to the fullest and avoid trouble at all cost my guy.
",High,"['IF a person shows in a post expressions of gratitude for friendships and excitement to reconnect, THEN extraversion is likely High because it reflects enthusiasm for social interactions and relationships.', 'IF a person shows in a post enjoyment in sharing humorous and fun experiences with friends, THEN extraversion is likely High because it indicates a lively social engagement.', 'IF a person shows in a post eagerness to make future plans with people, THEN extraversion is likely High because it illustrates a proactive approach to socialization.', 'IF a person shows in a post a focus on collective experiences and shared enjoyment, THEN extraversion is likely High because it emphasizes a desire for communal activities and friendships.']","['I was able to catch on things I have missed about my guys and reconnecting with them really gladdens my heart.', 'A superlative birthday shout out to my you my guy! You have really done well in your career and I am so happy for you on this special occassion of yours.', 'I will quickly connect them on all social media network to sustain the relationship so as not to lose.', 'I am really happy I attended this event as it really exposed me to a lot of persons I have not seen for a while.']",High,"{'Warmth': 1, 'Positive Emotions': 1, 'Sociability': 2}",1
49,"Saw one of my very good friends today! It was quite nostalgic; all those laughter and stories we never get to tell anyone else. He began kidding around and it was like, no time had elapsed and we were back in our childhood or teenage years telling stories of the places we used to hang around. One thing I’ve always grown to appreciate is the ability of friends to know you when you were still young and still support you to date. Thank you to people like this and for creating so many more wonderful memories! Cheers to the uncovered moments.  #Tbt #blessedfriends ","It is another great day for the love of my life, Happy Birthday to you! Today i celebrate you. You always bring so much joy and happiness in to my life, not to mention the patient and constant support. Thanks for every day, all the fun we have, the trips we take, the moments that matters to each of us. Happy anniversary to us yet again, Cheers to many more impressive years together by our side. Happy birthday to you and lots of happiness that you will be showered with today! #BirthdayWishes #BirthdayBoy ",Moderate,"['IF a person shows in a post a tendency to reminisce about past experiences rather than emphasize current engagements, THEN extraversion is likely Low because it suggests a preference for reflection over active social participation.', 'IF a person shows in a post feelings of nostalgia without present action, THEN extraversion is likely Low because it suggests reflection without current social motivation.', 'IF a person shows in a post a lack of emotive language and enthusiasm regarding social interactions, THEN extraversion is likely Low because it indicates a more reserved or introverted perspective.']","['It was quite nostalgic; all those laughter and stories we never get to tell anyone else.', 'It was like, no time had elapsed and we were back in our childhood or teenage years telling stories of the places we used to hang around.', 'Thank you to people like this and for creating so many more wonderful memories!']",Low,{'Sociability': 3},0
50,"What a blast from the past it was last night!   50 years since we all left Morgan and went out into the big wide world.   It was amazing to see some of the old faces, some I barely recognised while with others we went straight back to third year French class!  Awesome to catch up with Brucie, Govie and Tich, but sobering to hear about those who are no longer with us.   Be grateful for every day.","Woo hoo!  Bill is 70!   How did I come to be married to such an old man???   Thank you for putting up with me for all these years and am looking forward to celebrating with you tonight.  Play your cards right - I might just have a wee surprise for you later on!  In the meantime enjoy your cake, it's your favourite!",Low,"['IF a person shows in a post a tendency to reminisce about past experiences rather than emphasize current engagements, THEN extraversion is likely Low because it suggests a preference for reflection over active social participation.', 'IF a person shows in a post expressions of gratitude for friendships and excitement to reconnect, THEN extraversion is likely High because it reflects enthusiasm for social interactions and relationships.', 'IF a person shows in a post enjoyment and eagerness about future social events or gatherings, THEN extraversion is likely High because it highlights a desire for social engagement and connection.']","['What a blast from the past it was last night! 50 years since we all left Morgan and went out into the big wide world.', 'Awesome to catch up with Brucie, Govie and Tich, but sobering to hear about those who are no longer with us.', 'Thank you for putting up with me for all these years and am looking forward to celebrating with you tonight.']",Moderate,"{'Sociability': 1, 'Warmth': 1, 'Energy/Activity': 1}",0
53,"As I sit with my childhood friends, the years seem to melt away. The familiar banter, the inside jokes that we’ve carried like treasures through the years, and the way we all seem to pick up right where we left off—it’s like time stands still. I catch myself laughing more freely, feeling that easy comfort I once did when the world seemed so simple. There’s something about being with people who know you in your purest form, before the world shaped you in its various ways.

The conversation flows from old memories—those endless summer days, the mischief we got into, the places we’d hide out—and then shifts to where life has taken us. There’s a warmth in seeing how far we’ve all come, and yet, we’re still those same people at our core. It’s a reminder of roots, of the strength and depth of bonds that time and distance can never fully sever. Even as we talk about new chapters and changes, I realize how much of my past is written in the pages of these friendships.

It feels like being wrapped in a blanket of shared history, and for a moment, I feel grounded again—anchored in who I was, who I am, and who I will always be to these people. The laughter, the ease, the nostalgia—it’s all a kind of reminder that some things, like friendship, never truly change.","Another year with you feels like a gift I get to unwrap every single day. Watching you grow, laugh, and be the incredible person you are fills me with so much pride and gratitude. You are my heart, my best friend, and the person who makes everything brighter just by being you. ??

Thank you for the countless memories we’ve already made and the many more to come. Here’s to celebrating you today (and always), to all your dreams coming true, and to the endless adventures ahead. I’m beyond lucky to walk through life with you by my side. ????

You deserve all the happiness in the world, today and always. I love you more than words could ever say. ?? #BirthdayQueen/King #LuckyToCallYouMine",Moderate,"['IF a person shows in a post a tendency to reminisce about past experiences rather than emphasize current engagements, THEN extraversion is likely Low because it suggests a preference for reflection over active social participation.', 'IF a person shows in a post feelings of nostalgia without present action, THEN extraversion is likely Low because it suggests reflection without current social motivation.', 'IF a person shows in a post a focus on deep emotional connections over social activities, THEN extraversion is likely Low because it indicates a preference for intimate, rather than group interactions.']","['The conversation flows from old memories—those endless summer days, the mischief we got into, the places we’d hide out.', 'It feels like being wrapped in a blanket of shared history, and for a moment, I feel grounded again.', 'You are my heart, my best friend, and the person who makes everything brighter just by being you.']",Low,{'Sociability': 3},0
56,Finally back together again! Been far too long since we've seen each other but the three idiots are together and making mischief again at last. My cheeks and sides are already hurting from laughing too much. Time to set the world to rights and consume exhorbitant amounts of alcohol. Cheers!,"Happy birthday Big Ears! Just kidding, happy birthday to the loveliest man in the whole wide world! Another year older and just getting cuter (and somehow more silly) with age. Hope you have the best day with the best group of misfits and copious amounts of steak, cake an champagne! Lot's of prezzies waiting for you too!",Moderate,"['IF a person shows in a post enjoyment in sharing humorous and fun experiences with friends, THEN extraversion is likely High because it indicates a lively social engagement.', 'IF a person shows in a post enjoyment and eagerness about future social events or gatherings, THEN extraversion is likely High because it highlights a desire for social engagement and connection.', 'IF a person shows in a post a focus on collective experiences and shared enjoyment, THEN extraversion is likely High because it emphasizes a desire for communal activities and friendships.']","[""Been far too long since we've seen each other but the three idiots are together and making mischief again at last. My cheeks and sides are already hurting from laughing too much."", 'Time to set the world to rights and consume exhorbitant amounts of alcohol.', 'Hope you have the best day with the best group of misfits and copious amounts of steak, cake an champagne!']",High,"{'Positive Emotions': 1, 'Energy/Activity': 1, 'Sociability': 1}",0
