p,post1,post2,true_label,matched_rules,matched_behaviours,pred_rule_based,category_counts,score_rules
32,"A great thank you to my best childhood friends for organising this heart-warming event.
Emily, Sandra and Beckie - you are the best! 
Lots of stories and pictures were shared and we all thoroughly enjoyed a crazy ride down memory lane. It was great to see you all and see how you all got on in your lives girls!
Can't wait to do this again next year!","A very Happy birthday to my bestie!!! Roy, I want you to know that you are the best thing that ever happened to me. I am so glad we met and I love you unconditionally. I hope you have the best day celebrating your 40th birthday and I'm so here for it. 
You have touched the lives of so many people including mine and we are forever grateful for your optimistic, caring, and kind personality, hope you'll never change!
",Moderate,"['IF a person reflects on past memories with friends and focuses on nostalgia rather than the present moment in a post THEN extraversion is likely Low because this suggests a lack of enthusiasm for current socializing.', 'IF a person mentions past friendships without showing excitement about the connections in a post THEN extraversion is likely Low because this implies a preference for less social interaction.', 'IF a person expresses a lack of enthusiasm for social activities or describes them in a subdued tone in a post THEN extraversion is likely Low because this shows disinterest in social engagement.']","['Lots of stories and pictures were shared and we all thoroughly enjoyed a crazy ride down memory lane.', 'A great thank you to my best childhood friends for organising this heart-warming event.', 'A very Happy birthday to my bestie!!! Roy, I want you to know that you are the best thing that ever happened to me.']",High,{'Sociability': 3},0
34,"just been to a reunion with my childhood friends and it was a great night and i would like to thank them all for great night.
 it brought back some good memorys and good times. at least this time we got drunk legally and didn't have to run off when we got caught.
i think we  should all do it again in the very near future. ","i would like to wish my better half a very happy birthday and i hope you have a very good day. you are the best thing that ever happened to me and i would be lost with out you.
 i've got a few special things planned for us to do for your birthday and i hope you will enjoy yourself.
",Moderate,"['IF a person reflects on past memories with friends and focuses on nostalgia rather than the present moment in a post THEN extraversion is likely Low because this suggests a lack of enthusiasm for current socializing.', 'IF a person mentions past friendships without showing excitement about the connections in a post THEN extraversion is likely Low because this implies a preference for less social interaction.', 'IF a person expresses a lack of enthusiasm for social activities or describes them in a subdued tone in a post THEN extraversion is likely Low because this shows disinterest in social engagement.']","['it brought back some good memorys and good times.', 'just been to a reunion with my childhood friends and it was a great night and i would like to thank them all for great night.', 'i would like to wish my better half a very happy birthday and i hope you have a very good day.']",Low,{'Sociability': 3},0
35,Had a great catchup with my old friends today. It had been too long since we had last spoke with each other. Met up at a local pub and had some nice drinks and a great dinner. There was a show on across the road and we jumped over there after a few beers. Thanks for organising it guys and let's not wait too long for the next one! ,"Happy birthday, babe! Where has the year gone? It felt like only last month we were talking about our plans for the year and now nearly a whole other year has gone by. Don't feel too worked up about your age because I know it gets to you, sometimes. We'll go out and enjoy ourselves and treat it like an 18th to make you happy. Remember, it's better to be over the hill than buried under it.",High,"['IF a person expresses a lack of enthusiasm for social activities or describes them in a subdued tone in a post THEN extraversion is likely Low because this shows disinterest in social engagement.', 'IF a person expresses a lack of enthusiasm for social activities or describes them in a subdued tone in a post THEN extraversion is likely Low because this shows disinterest in social engagement.']","['Had a great catchup with my old friends today. It had been too long since we had last spoke with each other.', ""Thanks for organising it guys and let's not wait too long for the next one!""]",High,{'Sociability': 2},1
39,"Had an amazing night catching up with my childhood friends! It’s been way too long since we all got together. We reminisced about our wild adventures and laughed until our sides hurt. It’s crazy how some things never change, like our inside jokes and silly stories. Grateful for these friendships that stand the test of time! Can’t wait for the next reunion!","
Happy birthday to the love of my life! You bring so much joy and laughter into my world, and I’m endlessly grateful for every moment we share. Your kindness, strength, and passion inspire me every day. Here’s to celebrating you today and all the amazing adventures ahead! Can’t wait to spoil you and make this day unforgettable. Love you to the moon and back!",Moderate,"['IF a person expresses enthusiasm for future social activities or connections in a post THEN extraversion is likely High because this reflects a desire for social engagement.', 'IF a person shares positive feelings about a loved one and expresses excitement about celebrating them in a post THEN extraversion is likely High because this indicates a lively engagement with relationships.']","['Can’t wait for the next reunion!', 'Can’t wait to spoil you and make this day unforgettable.']",High,{'Uncategorized': 2},0
40,had fun today! got to see my friends that i've grown up with. im grateful to go through life with them and to see them grow as people. every accomplishment i will be there for becauase i know they will be there for me. i am truly grateful to have such a strong group of people around me and to uplift me.,"happy birthday my love. i am so proud of you. you are my best friend, my ace, my rock. i love you more than every. you keep me on my feet and you never let my crown tip. even trhrough all the trials and tribulations. i am lucky to have someone like you in my corner. you never fail to make me happt",Moderate,"['IF a person reflects on past memories with friends and focuses on nostalgia rather than the present moment in a post THEN extraversion is likely Low because this suggests a lack of enthusiasm for current socializing.', 'IF a person mentions past friendships without showing excitement about the connections in a post THEN extraversion is likely Low because this implies a preference for less social interaction.', 'IF a person mentions feeling reserved or distant in their interactions with others in a post THEN extraversion is likely Low because this reflects a tendency towards introversion and less engagement in social activities.', 'IF a person expresses a lack of enthusiasm for social activities or describes them in a subdued tone in a post THEN extraversion is likely Low because this shows disinterest in social engagement.', 'IF a person expresses gratitude and appreciation for their friends and shows engagement in their lives, THEN extraversion is likely High because this reflects positive social interactions and enthusiasm.', 'IF a person celebrates their close relationships and expresses strong affection in their posts, THEN extraversion is likely High because this indicates a high level of social engagement and connectivity.']","['None matched.', 'None matched.', 'None matched.', 'None matched.', 'i am truly grateful to have such a strong group of people around me and to uplift me.', 'i am so proud of you. you are my best friend, my ace, my rock.']",High,"{'Sociability': 4, 'Uncategorized': 2}",0
41,"So good to see these guys again, especially those I haven't seen for years. Brings me right back to the days of playing Minecraft together. Spent a great day in London together, going to a café and exploring all the places we used to go together, it was a really great day, and I'm definitely up to do it again.","Another year since birth for my favourite person on the planet, here's to many many many more together. I cannot express how much I love you, and I hope our day together lived up to that. We went to a really nice restaurant in town, which i would highly recommend everyone visits.",High,"['IF a person reflects on past memories with friends and focuses on nostalgia rather than the present moment in a post THEN extraversion is likely Low because this suggests a lack of enthusiasm for current socializing.', 'IF a person mentions past friendships without showing excitement about the connections in a post THEN extraversion is likely Low because this implies a preference for less social interaction.', 'IF a person expresses a lack of enthusiasm for social activities or describes them in a subdued tone in a post THEN extraversion is likely Low because this shows disinterest in social engagement.']","['Brings me right back to the days of playing Minecraft together.', ""So good to see these guys again, especially those I haven't seen for years."", 'I cannot express how much I love you, and I hope our day together lived up to that.']",Moderate,{'Sociability': 3},0
43,"Good to finally get back together with the crew haha, been a long time coming but definitely worth the wait. All those memories, all the good times and the best part about it, we get to recreate those memories and relive them every time we talk about them. Good to see everytime. Until the next time!","Happy birthday to the most gorgeous girl i've ever laid eyes on in my entire life. I always felt as though i was missing something in life, and now that i've found you i finally feel whole. I hope you have the best day and i hope you get everything you want out of life. Love you. I'll be raising a glass today, To more happiness and more memories!",Low,"['IF a person reflects on past memories with friends and focuses on nostalgia rather than the present moment in a post THEN extraversion is likely Low because this suggests a lack of enthusiasm for current socializing.', 'IF a person mentions feeling reserved or distant in their interactions with others in a post THEN extraversion is likely Low because this reflects a tendency towards introversion and less engagement in social activities.']","['Good to finally get back together with the crew haha, been a long time coming but definitely worth the wait. All those memories, all the good times and the best part about it, we get to recreate those memories and relive them every time we talk about them.', 'Until the next time!']",Low,{'Sociability': 2},1
46,"Such a crazy time with my bro from childhood. We got to this house party which was full of vibes. From the time we got there we knew it was going to be special. The decoration on the house was amazing. Massive shout out to whoever made the ribs, chicken wings and burgers - 10/10. Music was on point, dancing was on point too. We need to do this again.","Just want to send a special happy birthday to my wife - my best friend, my advisor, my partner in crime and in love. Your patience, kind heart, focus, intelligence and your resilience in the face of life's obstacles makes me so lucky to be called your husband. To witness and stand by the woman you've grown into is amazing. I look forward to celebrating many more birthdays with you. Happy birthday my love. ",Moderate,"['IF a person expresses enthusiasm for social activities or describes them in a lively tone in a post THEN extraversion is likely High because this indicates a strong engagement with social situations.', 'IF a person reflects positively on a social experience and expresses desire for future interactions in a post THEN extraversion is likely High because this shows eagerness to connect with others.', 'IF a person expresses warmth and affection towards others in a post THEN extraversion is likely High because this indicates a preference for close relationships and social connections.', 'IF a person shows excitement about celebrating future events or milestones in a post THEN extraversion is likely High because this reflects an investment in social relationships.']","['Such a crazy time with my bro from childhood. We got to this house party which was full of vibes.', 'We need to do this again.', 'Just want to send a special happy birthday to my wife - my best friend, my advisor, my partner in crime and in love.', 'I look forward to celebrating many more birthdays with you.']",High,{'Uncategorized': 4},0
47,I am really happy I attended this event as it really exposed me to a lot of persons I have not seen for a while. I was able to catch on things I have missed about my guys and reconnecting with them really gladdens my heart. I will quickly connect them on all social media network to sustain the relationship so as not to lose. Thank you guys.,"A superlative birthday shout out to my you my guy!
You have really done well in your career and I am so happy for you on this special occassion of yours. The Lord bless you real good brother.
I would have come around to say hello, but I am really busy right now.
Enjoy your day to the fullest and avoid trouble at all cost my guy.
",High,"['IF a person reflects on past memories with friends and focuses on nostalgia rather than the present moment in a post THEN extraversion is likely Low because this suggests a lack of enthusiasm for current socializing.', 'IF a person expresses a lack of enthusiasm for social activities or describes them in a subdued tone in a post THEN extraversion is likely Low because this shows disinterest in social engagement.']","['I was able to catch on things I have missed about my guys and reconnecting with them really gladdens my heart.', 'I would have come around to say hello, but I am really busy right now.']",Moderate,{'Sociability': 2},0
49,"Saw one of my very good friends today! It was quite nostalgic; all those laughter and stories we never get to tell anyone else. He began kidding around and it was like, no time had elapsed and we were back in our childhood or teenage years telling stories of the places we used to hang around. One thing I’ve always grown to appreciate is the ability of friends to know you when you were still young and still support you to date. Thank you to people like this and for creating so many more wonderful memories! Cheers to the uncovered moments.  #Tbt #blessedfriends ","It is another great day for the love of my life, Happy Birthday to you! Today i celebrate you. You always bring so much joy and happiness in to my life, not to mention the patient and constant support. Thanks for every day, all the fun we have, the trips we take, the moments that matters to each of us. Happy anniversary to us yet again, Cheers to many more impressive years together by our side. Happy birthday to you and lots of happiness that you will be showered with today! #BirthdayWishes #BirthdayBoy ",Moderate,"['IF a person reflects on past memories with friends and focuses on nostalgia rather than the present moment in a post THEN extraversion is likely Low because this suggests a lack of enthusiasm for current socializing.', 'IF a person mentions past friendships without showing excitement about the connections in a post THEN extraversion is likely Low because this implies a preference for less social interaction.']","['It was quite nostalgic; all those laughter and stories we never get to tell anyone else.', 'Thank you to people like this and for creating so many more wonderful memories!']",Low,{'Sociability': 2},0
57,"Tonight I discovered that if you hang out with a bunch of people who you were friends with in school but haven't seen for approximately.... 30 mumble years...., you will spend a LOT of the time feeling just as awkward as you did when you were a teenager, a LOT of the time comparing your current need for reading glasses and/or perimenopausal symptoms, and a LOT of the time feeling as though you've blocked out half your memories. ","40 today! Happy birthday to S. At what point do you think people will stop saying ""but you look about 12""? ?? Have a great day and I'll see you later for the birthday surprise. Just one question - how do you feel about abseiling/parachute jumping/crocodile wrestling? Asking for a friend, obviously.... ",Low,"['IF a person reflects on past memories with friends and focuses on nostalgia rather than the present moment in a post THEN extraversion is likely Low because this suggests a lack of enthusiasm for current socializing.', 'IF a person mentions feeling reserved or distant in their interactions with others in a post THEN extraversion is likely Low because this reflects a tendency towards introversion and less engagement in social activities.', 'IF a person expresses a lack of enthusiasm for social activities or describes them in a subdued tone in a post THEN extraversion is likely Low because this shows disinterest in social engagement.']","[""Tonight I discovered that if you hang out with a bunch of people who you were friends with in school but haven't seen for approximately.... 30 mumble years...., you will spend a LOT of the time feeling just as awkward as you did when you were a teenager."", 'you will spend a LOT of the time feeling just as awkward as you did when you were a teenager.', 'you will spend a LOT of the time feeling just as awkward as you did when you were a teenager.']",Low,{'Sociability': 3},1
58,Was so great to see my childhood friends at the catch up recently.  So many old faces and memories.  It's so weird how everything has changed but also stayed the same at the same time.  Lucky to still have such a great group and a toast to those that couldn't be with us. Missed and not forgotten. xo ,Well another year older but no wiser just about sums it up!  Happiest of birthdays to my partner in crime! Expanding the birthday out over a whole weekend with drinks and dinner on our weekend getaway. Let's drink great wine and eat all the cake! London here we come. We love you xxx,Low,"['IF a person reflects on past memories with friends and focuses on nostalgia rather than the present moment in a post THEN extraversion is likely Low because this suggests a lack of enthusiasm for current socializing.', 'IF a person mentions past friendships without showing excitement about the connections in a post THEN extraversion is likely Low because this implies a preference for less social interaction.', 'IF a person expresses a lack of enthusiasm for social activities or describes them in a subdued tone in a post THEN extraversion is likely Low because this shows disinterest in social engagement.']","['Was so great to see my childhood friends at the catch up recently. So many old faces and memories.', ""Lucky to still have such a great group and a toast to those that couldn't be with us. Missed and not forgotten."", 'Well another year older but no wiser just about sums it up!']",Low,{'Sociability': 3},1
60,"Seeing all my old friends today as we gather for a meal in our favourite local restaurant has made me feel so nostalgic and happy. We all grew up together and went to the same little local school, it feels so long ago and we and the world around has changed so much, sometimes I think too much, and to able to get together and share all our memories is so comforting.","To my lovely and supportive partner, whose birthday it is today, I hope you have a lovely need and get everything you wish for, you certainly deserve it, you have been a wonderful partner to me and such a good father to our sons, where would we be without you, you always put us first and show us you care, it means the world to us to know we have your love and support.",Low,"['IF a person reflects on past memories with friends and focuses on nostalgia rather than the present moment in a post THEN extraversion is likely Low because this suggests a lack of enthusiasm for current socializing.', 'IF a person mentions past friendships without showing excitement about the connections in a post THEN extraversion is likely Low because this implies a preference for less social interaction.']","['Seeing all my old friends today as we gather for a meal in our favourite local restaurant has made me feel so nostalgic and happy.', 'We all grew up together and went to the same little local school, it feels so long ago and we and the world around has changed so much.']",Low,{'Sociability': 2},1
