p,post1,post2,true_label,matched_rules,matched_behaviours,pred_rule_based,category_counts,score_rules
53,"As I sit with my childhood friends, the years seem to melt away. The familiar banter, the inside jokes that we’ve carried like treasures through the years, and the way we all seem to pick up right where we left off—it’s like time stands still. I catch myself laughing more freely, feeling that easy comfort I once did when the world seemed so simple. There’s something about being with people who know you in your purest form, before the world shaped you in its various ways.

The conversation flows from old memories—those endless summer days, the mischief we got into, the places we’d hide out—and then shifts to where life has taken us. There’s a warmth in seeing how far we’ve all come, and yet, we’re still those same people at our core. It’s a reminder of roots, of the strength and depth of bonds that time and distance can never fully sever. Even as we talk about new chapters and changes, I realize how much of my past is written in the pages of these friendships.

It feels like being wrapped in a blanket of shared history, and for a moment, I feel grounded again—anchored in who I was, who I am, and who I will always be to these people. The laughter, the ease, the nostalgia—it’s all a kind of reminder that some things, like friendship, never truly change.","Another year with you feels like a gift I get to unwrap every single day. Watching you grow, laugh, and be the incredible person you are fills me with so much pride and gratitude. You are my heart, my best friend, and the person who makes everything brighter just by being you. ??

Thank you for the countless memories we’ve already made and the many more to come. Here’s to celebrating you today (and always), to all your dreams coming true, and to the endless adventures ahead. I’m beyond lucky to walk through life with you by my side. ????

You deserve all the happiness in the world, today and always. I love you more than words could ever say. ?? #BirthdayQueen/King #LuckyToCallYouMine",Moderate,"['IF a person shows in a post excitement about reuniting with friends and expresses joy about reminiscing together, THEN extraversion is likely High because it indicates a positive engagement with social interactions.', 'IF a person shows in a post joy derived from spending time with friends and sharing funny memories, THEN extraversion is likely High because it highlights an enjoyment of group dynamics.', ""IF a person shows in a post a strong emphasis on their partner's achievements and plans for celebrations, THEN extraversion is likely High because it highlights their social connectivity and optimism for shared experiences."", 'IF a person shows in a post that expresses enthusiasm and humor about past shared experiences with friends, THEN extraversion is likely High because it reveals a cheerful view on social connections.']","['As I sit with my childhood friends, the years seem to melt away. The familiar banter, the inside jokes that we’ve carried like treasures through the years...', 'The conversation flows from old memories—those endless summer days, the mischief we got into...', 'Thank you for the countless memories we’ve already made and the many more to come. Here’s to celebrating you today (and always), to all your dreams coming true...', 'The laughter, the ease, the nostalgia—it’s all a kind of reminder that some things, like friendship, never truly change.']",High,"{'Positive Emotions': 3, 'Uncategorized': 1}",0
55,"Highschool reunion! Had such a blast hanging out with these lovely people. Thank you Annie for organising and getting us all back together for such a fun and frivolous evening. Good food, excellent drinks and brilliant company. Would definitely recommend the venue we were hanging out in. And the theme was so much fun! I think we looked amazing in our fancy dress.","Congrats Jamie for surviving another year! It's definitely been a wild one between miving in, new job and adopting our first fur baby. I feel very lucky to be able to celebrate this birthday with you. Here we are enjoying dinner at the Sky Garden, picture taken by our lovely server for the evening. Can't wait to make more memories like this with you.",Moderate,"['IF a person shows in a post excitement about reuniting with friends and expresses joy about reminiscing together, THEN extraversion is likely High because it indicates a positive engagement with social interactions.', 'IF a person shows in a post a desire to get together with friends and make new memories, THEN extraversion is likely High because it reflects an eagerness for social interaction.', 'IF a person shows in a post enthusiasm and humor about past shared experiences with friends, THEN extraversion is likely High because it reveals a cheerful view on social connections.']","['Had such a blast hanging out with these lovely people.', ""Can't wait to make more memories like this with you."", 'Would definitely recommend the venue we were hanging out in. And the theme was so much fun!']",High,"{'Positive Emotions': 2, 'Sociability': 1}",0
59,"Had an amazing evening, sharing a few cheeky drinks  with some interesting people from a long time ago. It was great catching up with people from the past , sharing memories from our younger years, and sharing with everyone where life has taken us. Hopefully we won`t leave it so long before we catch up again   ","Happy 60th birthday Phil , now you can finally be the grumpy OLD man you`ve always like for the last 30 years ha ha . 
Enjoy your day , I`ll book the hearing test and eye test for next week . The zimmer frame should be delivered over the few days ha ha , until then , sit back, relax and watch your gardening programmes ( nothing new there ha ha ) xx",High,"['IF a person shows in a post excitement about reuniting with friends and expresses joy about reminiscing together, THEN extraversion is likely High because it indicates a positive engagement with social interactions.', 'IF a person shows in a post enthusiasm and humor about past shared experiences with friends, THEN extraversion is likely High because it reveals a cheerful view on social connections.', 'IF a person shows in a post a desire to get together with friends and make new memories, THEN extraversion is likely High because it reflects an eagerness for social interaction.']","['It was great catching up with people from the past, sharing memories from our younger years.', 'Happy 60th birthday Phil, now you can finally be the grumpy OLD man you`ve always like for the last 30 years ha ha.', 'Hopefully we won`t leave it so long before we catch up again.']",High,"{'Positive Emotions': 2, 'Sociability': 1}",1
