p,post1,post2,true_label,matched_rules,matched_behaviours,pred_rule_based,category_counts,score_rules
31,Long awaited catch up with life long friends!  Why has it taken so long? It was so good to catch up with everybody.  It has been so great seeing how we have all changed and grown both physically and spiritually.  Let me know who is up for making this an annual event? Please let me know.  I am happy to organise it.  Feeling blessed.  Cheers everyone!,"Happy birthday to the best and most wonderful husband I could ever ask for xx  Thank you for everything you do. Thank you for being an awesome dad to our two children. Enjoy your day and look forward the birthday celebrations tonight.  Enjoy your gifts. 
 You  so deserve them.  Love as always.",High,"['IF a person shows in a post excitement about reuniting with friends and expresses joy about reminiscing together, THEN extraversion is likely High because it indicates a positive engagement with social interactions.', 'IF a person shows in a post a desire to get together with friends and make new memories, THEN extraversion is likely High because it reflects an eagerness for social interaction.', 'IF a person shows in a post regard for social events as therapeutic and expresses eagerness to repeat them soon, THEN extraversion is likely High because it demonstrates enthusiasm for potential future interactions.', ""IF a person shows in a post a strong emphasis on their partner's achievements and plans for celebrations, THEN extraversion is likely High because it highlights their social connectivity and optimism for shared experiences.""]","['It was so good to catch up with everybody.', 'Let me know who is up for making this an annual event?', 'I am happy to organise it.', 'Enjoy your day and look forward the birthday celebrations tonight.']",High,"{'Positive Emotions': 3, 'Sociability': 1}",1
32,"A great thank you to my best childhood friends for organising this heart-warming event.
Emily, Sandra and Beckie - you are the best! 
Lots of stories and pictures were shared and we all thoroughly enjoyed a crazy ride down memory lane. It was great to see you all and see how you all got on in your lives girls!
Can't wait to do this again next year!","A very Happy birthday to my bestie!!! Roy, I want you to know that you are the best thing that ever happened to me. I am so glad we met and I love you unconditionally. I hope you have the best day celebrating your 40th birthday and I'm so here for it. 
You have touched the lives of so many people including mine and we are forever grateful for your optimistic, caring, and kind personality, hope you'll never change!
",Moderate,"['IF a person shows in a post excitement about reuniting with friends and expresses joy about reminiscing together, THEN extraversion is likely High because it indicates a positive engagement with social interactions.', 'IF a person shows in a post a desire to get together with friends and make new memories, THEN extraversion is likely High because it reflects an eagerness for social interaction.', ""IF a person shows in a post a strong emphasis on their partner's achievements and plans for celebrations, THEN extraversion is likely High because it highlights their social connectivity and optimism for shared experiences.""]","['Lots of stories and pictures were shared and we all thoroughly enjoyed a crazy ride down memory lane.', ""Can't wait to do this again next year!"", ""I hope you have the best day celebrating your 40th birthday and I'm so here for it.""]",High,"{'Positive Emotions': 2, 'Sociability': 1}",0
33,Back with the besties! Hanging with my buds from grade school… can’t believe how long it’s been. After all this time they all still get it. Anyone who want to get a drink come on by. High school may have been fifteen years ago but it still feels like we graduated just yesterday. ,Happy birthday to my best friend and partner in crime. It’s crazy all we’ve been through in the past fifteen years. Through all the ups and downs you have always been there for me. I couldn’t ask for a better person to share my life with. Happy birthday and here’s to the next decade together. ,Low,"['IF a person shows in a post excitement about reuniting with friends and expresses joy about reminiscing together, THEN extraversion is likely High because it indicates a positive engagement with social interactions.', 'IF a person shows in a post a desire to get together with friends and make new memories, THEN extraversion is likely High because it reflects an eagerness for social interaction.', 'IF a person shows in a post joy derived from spending time with friends and sharing funny memories, THEN extraversion is likely High because it highlights an enjoyment of group dynamics.', ""IF a person shows in a post a strong emphasis on their partner's achievements and plans for celebrations, THEN extraversion is likely High because it highlights their social connectivity and optimism for shared experiences.""]","['Back with the besties! Hanging with my buds from grade school… can’t believe how long it’s been.', 'Anyone who want to get a drink come on by.', 'High school may have been fifteen years ago but it still feels like we graduated just yesterday.', 'Happy birthday to my best friend and partner in crime. It’s crazy all we’ve been through in the past fifteen years.']",High,"{'Positive Emotions': 3, 'Sociability': 1}",0
35,Had a great catchup with my old friends today. It had been too long since we had last spoke with each other. Met up at a local pub and had some nice drinks and a great dinner. There was a show on across the road and we jumped over there after a few beers. Thanks for organising it guys and let's not wait too long for the next one! ,"Happy birthday, babe! Where has the year gone? It felt like only last month we were talking about our plans for the year and now nearly a whole other year has gone by. Don't feel too worked up about your age because I know it gets to you, sometimes. We'll go out and enjoy ourselves and treat it like an 18th to make you happy. Remember, it's better to be over the hill than buried under it.",High,"['IF a person shows in a post excitement about reuniting with friends and expresses joy about reminiscing together, THEN extraversion is likely High because it indicates a positive engagement with social interactions.', 'IF a person shows in a post a desire to get together with friends and make new memories, THEN extraversion is likely High because it reflects an eagerness for social interaction.', 'IF a person shows in a post joy derived from spending time with friends and sharing funny memories, THEN extraversion is likely High because it highlights an enjoyment of group dynamics.', ""IF a person shows in a post a strong emphasis on their partner's achievements and plans for celebrations, THEN extraversion is likely High because it highlights their social connectivity and optimism for shared experiences.""]","['Had a great catchup with my old friends today. It had been too long since we had last spoke with each other.', ""Thanks for organising it guys and let's not wait too long for the next one!"", 'Met up at a local pub and had some nice drinks and a great dinner.', ""Happy birthday, babe! ... We'll go out and enjoy ourselves and treat it like an 18th to make you happy.""]",High,"{'Positive Emotions': 3, 'Sociability': 1}",1
37,"After some years, I was finally able to spend some time with my old pal X from back home. It feels unreal to spend time with them after so many years spent apart and after so many things happened, whether it was moving abroad, new jobs or big family events. X you mean a lot and I cherish our friendship ","I still can't express how lucky I am to have you in my life, ever since I met you, you have been a integral part of my life and I can't express how much you mean to me and how much I love you. Happy birthday, I really mean that, wish you a happy birthday and may the years be kind to us",Moderate,"['IF a person shows in a post excitement about reuniting with friends and expresses joy about reminiscing together, THEN extraversion is likely High because it indicates a positive engagement with social interactions.', 'IF a person shows in a post an appreciation for intimate moments without referencing larger social interactions, THEN extraversion is likely Low because it implies a preference for deep connections over social engagement.']","['It feels unreal to spend time with them after so many years spent apart.', ""I can't express how much you mean to me and how much I love you.""]",Moderate,"{'Positive Emotions': 1, 'Sociability': 1}",1
38,"chlilling with my longest know friends. I can't believe we've known each other for as long as we have. I treasure this and I hope I can continue my life with you guys until the very end. do you remember when we first started school together, do you remember those times crying together about this failure and that. do you remember the times that we got to celebrate this achievement and that quality? ","Happy birhday my love. Here's to many more to come. You've grown so much this year and I'm so glad that we're celebrating our tenth year together. Hope you love your gifts and surprises. And thank you to everyone who wishes us the best. happy birthday to you, happy birthday to your mother and farther who birthed such a wonderful being",Low,"['IF a person shows in a post excitement about reuniting with friends and expresses joy about reminiscing together, THEN extraversion is likely High because it indicates a positive engagement with social interactions.', 'IF a person shows in a post joy derived from spending time with friends and sharing funny memories, THEN extraversion is likely High because it highlights an enjoyment of group dynamics.', ""IF a person shows in a post a strong emphasis on their partner's achievements and plans for celebrations, THEN extraversion is likely High because it highlights their social connectivity and optimism for shared experiences."", 'IF a person shows in a post a flat expression of gratitude without a playful or engaging tone, THEN extraversion is likely Low because it suggests a disengaged attitude towards social relationships.']","[""I can't believe we've known each other for as long as we have. I treasure this and I hope I can continue my life with you guys until the very end."", 'do you remember the times that we got to celebrate this achievement and that quality?', ""Happy birthday my love. Here's to many more to come. You've grown so much this year and I'm so glad that we're celebrating our tenth year together."", 'And thank you to everyone who wishes us the best.']",Moderate,"{'Positive Emotions': 3, 'Warmth': 1}",0
40,had fun today! got to see my friends that i've grown up with. im grateful to go through life with them and to see them grow as people. every accomplishment i will be there for becauase i know they will be there for me. i am truly grateful to have such a strong group of people around me and to uplift me.,"happy birthday my love. i am so proud of you. you are my best friend, my ace, my rock. i love you more than every. you keep me on my feet and you never let my crown tip. even trhrough all the trials and tribulations. i am lucky to have someone like you in my corner. you never fail to make me happt",Moderate,"['IF a person shows in a post excitement about reuniting with friends and expresses joy about reminiscing together, THEN extraversion is likely High because it indicates a positive engagement with social interactions.', 'IF a person shows in a post joy derived from spending time with friends and sharing funny memories, THEN extraversion is likely High because it highlights an enjoyment of group dynamics.', ""IF a person shows in a post a strong emphasis on their partner's achievements and plans for celebrations, THEN extraversion is likely High because it highlights their social connectivity and optimism for shared experiences.""]","[""had fun today! got to see my friends that i've grown up with."", 'i am truly grateful to have such a strong group of people around me and to uplift me.', 'happy birthday my love. i am so proud of you.']",High,{'Positive Emotions': 3},0
45,"I visited some of my childhood friends that I haven't seen in many years. We reminisced about all of the good times we experienced together and had a fun time for many hours down at the local bar. I talked with many friends who I had even forgot existed, but we sat down at remembered many moments we shared together.",Happy birthday to my significant other. They are such an amazing person and I am glad to have spent the last few years of my life with them. I am already looking forward to spending the future and hopefully the rest of my life with them. We have already spent so many good moments together.,Moderate,"['IF a person shows in a post excitement about reuniting with friends and expresses joy about reminiscing together, THEN extraversion is likely High because it indicates a positive engagement with social interactions.', 'IF a person shows in a post joy derived from spending time with friends and sharing funny memories, THEN extraversion is likely High because it highlights an enjoyment of group dynamics.', ""IF a person shows in a post a strong emphasis on their partner's achievements and plans for celebrations, THEN extraversion is likely High because it highlights their social connectivity and optimism for shared experiences."", 'IF a person shows in a post regard for social events as therapeutic and expresses eagerness to repeat them soon, THEN extraversion is likely High because it demonstrates enthusiasm for potential future interactions.']","['We reminisced about all of the good times we experienced together and had a fun time for many hours down at the local bar.', 'I talked with many friends who I had even forgot existed, but we sat down at remembered many moments we shared together.', 'Happy birthday to my significant other. They are such an amazing person and I am glad to have spent the last few years of my life with them.', 'I am already looking forward to spending the future and hopefully the rest of my life with them.']",High,{'Positive Emotions': 4},0
46,"Such a crazy time with my bro from childhood. We got to this house party which was full of vibes. From the time we got there we knew it was going to be special. The decoration on the house was amazing. Massive shout out to whoever made the ribs, chicken wings and burgers - 10/10. Music was on point, dancing was on point too. We need to do this again.","Just want to send a special happy birthday to my wife - my best friend, my advisor, my partner in crime and in love. Your patience, kind heart, focus, intelligence and your resilience in the face of life's obstacles makes me so lucky to be called your husband. To witness and stand by the woman you've grown into is amazing. I look forward to celebrating many more birthdays with you. Happy birthday my love. ",Moderate,"['IF a person shows in a post excitement about reuniting with friends and expresses joy about reminiscing together, THEN extraversion is likely High because it indicates a positive engagement with social interactions.', 'IF a person shows in a post a desire to get together with friends and make new memories, THEN extraversion is likely High because it reflects an eagerness for social interaction.', ""IF a person shows in a post a strong emphasis on their partner's achievements and plans for celebrations, THEN extraversion is likely High because it highlights their social connectivity and optimism for shared experiences.""]","['Such a crazy time with my bro from childhood. We got to this house party which was full of vibes.', 'We need to do this again.', 'I look forward to celebrating many more birthdays with you.']",High,"{'Positive Emotions': 2, 'Sociability': 1}",0
48,It feels so good to have the gang back together again! we had a lush dinner at Il Michelangelo and won a few games of bowling over at AllStars xoxo we loved reliving the same excitement from when we were young ~ that was 13 years ago! :O &lt;3 P.S. no one noticed that my heel was starting to break...,"my darling, my dearest. I couldn't imagine life without you and your dimpled smiles and cuddles. when life gets tough, you're there for me and me for you. I feel so blessed that we found each other and that we get to share this adventure of life together. You've hit a quarter of a century and here's to many more. I love you, happy birthday! &lt;3",Low,"['IF a person shows in a post excitement about reuniting with friends and expresses joy about reminiscing together, THEN extraversion is likely High because it indicates a positive engagement with social interactions.', 'IF a person shows in a post joy derived from spending time with friends and sharing funny memories, THEN extraversion is likely High because it highlights an enjoyment of group dynamics.', 'IF a person shows in a post enthusiasm and humor about past shared experiences with friends, THEN extraversion is likely High because it reveals a cheerful view on social connections.', ""IF a person shows in a post a strong emphasis on their partner's achievements and plans for celebrations, THEN extraversion is likely High because it highlights their social connectivity and optimism for shared experiences.""]","['It feels so good to have the gang back together again!', 'we had a lush dinner at Il Michelangelo and won a few games of bowling over at AllStars xoxo', 'we loved reliving the same excitement from when we were young ~ that was 13 years ago!', ""You've hit a quarter of a century and here's to many more.""]",High,{'Positive Emotions': 4},0
49,"Saw one of my very good friends today! It was quite nostalgic; all those laughter and stories we never get to tell anyone else. He began kidding around and it was like, no time had elapsed and we were back in our childhood or teenage years telling stories of the places we used to hang around. One thing I’ve always grown to appreciate is the ability of friends to know you when you were still young and still support you to date. Thank you to people like this and for creating so many more wonderful memories! Cheers to the uncovered moments.  #Tbt #blessedfriends ","It is another great day for the love of my life, Happy Birthday to you! Today i celebrate you. You always bring so much joy and happiness in to my life, not to mention the patient and constant support. Thanks for every day, all the fun we have, the trips we take, the moments that matters to each of us. Happy anniversary to us yet again, Cheers to many more impressive years together by our side. Happy birthday to you and lots of happiness that you will be showered with today! #BirthdayWishes #BirthdayBoy ",Moderate,"['IF a person shows in a post excitement about reuniting with friends and expresses joy about reminiscing together, THEN extraversion is likely High because it indicates a positive engagement with social interactions.', 'IF a person shows in a post joy derived from spending time with friends and sharing funny memories, THEN extraversion is likely High because it highlights an enjoyment of group dynamics.', ""IF a person shows in a post a strong emphasis on their partner's achievements and plans for celebrations, THEN extraversion is likely High because it highlights their social connectivity and optimism for shared experiences."", 'IF a person shows in a post regard for social events as therapeutic and expresses eagerness to repeat them soon, THEN extraversion is likely High because it demonstrates enthusiasm for potential future interactions.']","['It was quite nostalgic; all those laughter and stories we never get to tell anyone else.', 'It was like, no time had elapsed and we were back in our childhood or teenage years telling stories.', 'Happy Birthday to you! Today I celebrate you. You always bring so much joy and happiness into my life.', 'Cheers to many more impressive years together by our side.']",High,{'Positive Emotions': 4},0
50,"What a blast from the past it was last night!   50 years since we all left Morgan and went out into the big wide world.   It was amazing to see some of the old faces, some I barely recognised while with others we went straight back to third year French class!  Awesome to catch up with Brucie, Govie and Tich, but sobering to hear about those who are no longer with us.   Be grateful for every day.","Woo hoo!  Bill is 70!   How did I come to be married to such an old man???   Thank you for putting up with me for all these years and am looking forward to celebrating with you tonight.  Play your cards right - I might just have a wee surprise for you later on!  In the meantime enjoy your cake, it's your favourite!",Low,"['IF a person shows in a post excitement about reuniting with friends and expresses joy about reminiscing together, THEN extraversion is likely High because it indicates a positive engagement with social interactions.', 'IF a person shows in a post joy derived from spending time with friends and sharing funny memories, THEN extraversion is likely High because it highlights an enjoyment of group dynamics.', ""IF a person shows in a post a strong emphasis on their partner's achievements and plans for celebrations, THEN extraversion is likely High because it highlights their social connectivity and optimism for shared experiences."", 'IF a person shows in a post enthusiasm and humor about past shared experiences with friends, THEN extraversion is likely High because it reveals a cheerful view on social connections.']","['What a blast from the past it was last night! It was amazing to see some of the old faces.', 'Awesome to catch up with Brucie, Govie and Tich, but sobering to hear about those who are no longer with us.', 'Woo hoo! Bill is 70! ... looking forward to celebrating with you tonight.', 'How did I come to be married to such an old man??? ... I might just have a wee surprise for you later on!']",High,{'Positive Emotions': 4},0
52,it been a long time and it has been so long we see each other since childhood i moved house and left my day ones and now it is an opportunity to meet with them again we have gone through high school and tertiary institution and everybody is happy seeing each other yeah everyone is happy to meet each other and so everyone is with their family. what a joy to meet again,happy birthday to the best friends i ever had today is a special day for you and i am happy and felicitate you on your day. long life and prosperity. what a wonderful day for you as you have been a wonderful friend it is a pleasure to share this day with you. may your heart be filled with joy and your face with smile and your day with happiness and your mind with peace,Low,"['IF a person shows in a post excitement about reuniting with friends and expresses joy about reminiscing together, THEN extraversion is likely High because it indicates a positive engagement with social interactions.', 'IF a person shows in a post a desire to get together with friends and make new memories, THEN extraversion is likely High because it reflects an eagerness for social interaction.', 'IF a person shows in a post enthusiasm and humor about past shared experiences with friends, THEN extraversion is likely High because it reveals a cheerful view on social connections.', ""IF a person shows in a post a strong emphasis on their partner's achievements and plans for celebrations, THEN extraversion is likely High because it highlights their social connectivity and optimism for shared experiences.""]","['what a joy to meet again', 'it is an opportunity to meet with them again', 'everybody is happy seeing each other', 'happy birthday to the best friends i ever had']",High,"{'Positive Emotions': 3, 'Sociability': 1}",0
