p,post1,post2,true_label,matched_rules,matched_behaviours,pred_rule_based,category_counts,score_rules
51,"Nothing like catching up with the people who knew you way back when life was all about playground games and ice cream. Tonight was full of laughter, nostalgia, and stories that makes sense ti us. So grateful for these lifelong friendships that pick up right where we left off, no matter how long it's been. Love childhood memories.","Happy birthday to my fav person in this whole world. I'm so lucky to walk through life with you side by side. You bring so much joy, laughter, and love into my life every day. Cheers to another year of adventures, growth, and amazing memories together. Love you more than words could explain. #Happy birthday ",High,"['IF a person shows in a post a tendency to mention feeling awkward or uncomfortable in social settings, THEN extraversion is likely Low because it highlights a struggle with social interactions.']",[''],High,{'Uncategorized': 1},1
56,Finally back together again! Been far too long since we've seen each other but the three idiots are together and making mischief again at last. My cheeks and sides are already hurting from laughing too much. Time to set the world to rights and consume exhorbitant amounts of alcohol. Cheers!,"Happy birthday Big Ears! Just kidding, happy birthday to the loveliest man in the whole wide world! Another year older and just getting cuter (and somehow more silly) with age. Hope you have the best day with the best group of misfits and copious amounts of steak, cake an champagne! Lot's of prezzies waiting for you too!",Moderate,"['IF a person shows in a post a tendency to mention feeling awkward or uncomfortable in social settings, THEN extraversion is likely Low because it highlights a struggle with social interactions.']",['None'],High,{'Uncategorized': 1},0
59,"Had an amazing evening, sharing a few cheeky drinks  with some interesting people from a long time ago. It was great catching up with people from the past , sharing memories from our younger years, and sharing with everyone where life has taken us. Hopefully we won`t leave it so long before we catch up again   ","Happy 60th birthday Phil , now you can finally be the grumpy OLD man you`ve always like for the last 30 years ha ha . 
Enjoy your day , I`ll book the hearing test and eye test for next week . The zimmer frame should be delivered over the few days ha ha , until then , sit back, relax and watch your gardening programmes ( nothing new there ha ha ) xx",High,"['IF a person shows in a post a tendency to mention feeling awkward or uncomfortable in social settings, THEN extraversion is likely Low because it highlights a struggle with social interactions.']",['None of the posts indicate feeling awkward or uncomfortable in social settings.'],High,{'Uncategorized': 1},1
60,"Seeing all my old friends today as we gather for a meal in our favourite local restaurant has made me feel so nostalgic and happy. We all grew up together and went to the same little local school, it feels so long ago and we and the world around has changed so much, sometimes I think too much, and to able to get together and share all our memories is so comforting.","To my lovely and supportive partner, whose birthday it is today, I hope you have a lovely need and get everything you wish for, you certainly deserve it, you have been a wonderful partner to me and such a good father to our sons, where would we be without you, you always put us first and show us you care, it means the world to us to know we have your love and support.",Low,[],[],Unknown,{},0
