p,post1,post2,true_label,matched_rules,matched_behaviours,pred_rule_based,category_counts,score_rules
1,OMG we went to the movie theater and watched a new movie and had fun there was a cute boy a few rolls up from us and we was throwing popcorn at him to get his attention he met us outside after the movies and we talked and exchanged phone numbers and we've been talking ever since me and my friends enjoyed this night,I just want to shout out happy birthday to my amazing husband he always does everything for us and gets up and goes to work and works hard everyday to provide everything that we need I just want to say I'm so grateful for him and everything he has done for me and our children and I will continue to be grateful everyday,High,['IF a person describes enjoying going out with a group of friends and engaging in social activities positively in their post THEN extraversion is likely High because they show enthusiasm for social interactions.'],['OMG we went to the movie theater and watched a new movie and had fun there was a cute boy a few rolls up from us and we was throwing popcorn at him to get his attention.'],High,{'Sociability': 1},1
4,"Wow! It's so great to see everyone after all this time! I am so excited to be here and catch up on all that we missed over time. It's great to see all these familiar faces smiling back at me! I really have missed you and seeing you here and now, I am reminded of some of the best times of my life!","Happy Birthday XXXX! Just wanted you to know I was thinking about you on your special day and wish you many more! I know that you will a wonderful journey ahead of you in days to come and I will be there to cheer you on the whole way. Enjoy your day, take some time to yourself and start back to work tomorrow. L,S",Moderate,['IF a person describes enjoying going out with a group of friends and engaging in social activities positively in their post THEN extraversion is likely High because they show enthusiasm for social interactions.'],"[""Wow! It's so great to see everyone after all this time! I am so excited to be here and catch up on all that we missed over time.""]",High,{'Sociability': 1},0
6,today guys I have reunited with my childhood friends and I was so excited. it was an amazing experience which I totally recommend if you can do it as the feeling of meeting someone you used to play with when you talked to them is unforgettable. Also the fact that you used to be so close with them is shocking!,"Happy birthday dear. I am so happy to see you growing up bit by bit. I always see that amazing special smile once a year, unique from the others and that makes me overjoyed. I wish you the best of many days and years to come and I hope you find my gifts splendid aswell as everyone elses.",High,"['IF a person describes enjoying going out with a group of friends and engaging in social activities positively in their post THEN extraversion is likely High because they show enthusiasm for social interactions.', 'IF a person shares enjoyment from reminiscing about past friendships but doesn’t show eagerness for new social interactions in their post THEN extraversion is likely Low because it implies comfort in familiarity rather than a drive for new social experiences.']","['I have reunited with my childhood friends and I was so excited.', 'the feeling of meeting someone you used to play with when you talked to them is unforgettable.']",High,{'Sociability': 2},1
7,"Had a lovely time with the girls today, we went to our favourite childhood restaurant. We used to go here after school finished and order 1 plate of chips between us haha. 15 years of friendship down, a lifetime to go. I know our teachers that told us we spoke too much in class are mad haha.",My lover my lover. Happy Birthday to you. You're getting old but at least you still look fly haha. I hope you have a fabulous day today filled with love and joy and many more birthdays.  You're truly one of a kind. I love you dearly and cant wait to spend the rest of the day with you.,High,"['IF a person describes a quiet evening spent at home focusing on food over social interactions in their post THEN extraversion is likely Low because it suggests a preference for solitary activities.', 'IF a person reflects on having shared meaningful moments with their partner and shows a lack of social enthusiasm in their post THEN extraversion is likely Low because it suggests a preference for deep, intimate connections over wider social interactions.', 'IF a person indicates plans and priorities focused on a partner rather than broader social gatherings in their post THEN extraversion is likely Low because it reflects a more personal and less socially expansive outlook.']","['Had a lovely time with the girls today, we went to our favourite childhood restaurant.', ""You're truly one of a kind. I love you dearly and can't wait to spend the rest of the day with you."", ""I can't wait to spend the rest of the day with you.""]",Low,"{'Uncategorized': 1, 'Warmth': 1, 'Sociability': 1}",0
8,"time flies by, I cant believe its been so long since we all met,  had so much fun seeing you all again and catching up. I remember when we used to go out on our bikes for hours now we all have our own house's. its crazy. we should make this an annual thing every year. none of you have changed! ","Happpy Birthdayyyy. I hope your day is filled with all the things you love and your favorite people. This last year has been amazing and i cant wait to celebrate every birthday with you, even when we are old we'll still have each others company. Love you and cant wait to celebrate this day with you.",Moderate,"['IF a person describes enjoying going out with a group of friends and engaging in social activities positively in their post THEN extraversion is likely High because they show enthusiasm for social interactions.', 'IF a person indicates plans and priorities focused on a partner rather than broader social gatherings in their post THEN extraversion is likely Low because it reflects a more personal and less socially expansive outlook.']","['had so much fun seeing you all again and catching up.', 'I cant wait to celebrate every birthday with you.']",High,{'Sociability': 2},0
10,"having a brill time at the reunion, saw lots of faces i've not seen in a longggggg time. we mustn't leave it so long next time. just waiting for the karaoke to begin so i can impress everyone with a bit of Enrique ! I hope everyone doesn't leave the room when I start singing otherwise i'll never dare pick up a microphone ever again.  Talking about old times at school was a blast....rekindled many good memories.","Happy Birthday to Khaleesy ! Hope you liked the flowers babe, I'll see you when I get home ....expect the princess treatment !!! love you  xxxxx

You always say that my messages on here are too short so i'm making an effort to write you a longgggggggggggggggggg one this time hahaha

happy birthday to you, happy birthday to you, happy birthday Khaleesy, Happy Birthday too youuuuuuuuuuuuuu....uuuuuuuu xxxxx",High,"['IF a person describes enjoying going out with a group of friends and engaging in social activities positively in their post THEN extraversion is likely High because they show enthusiasm for social interactions.', 'IF a person describes a positive experience of socializing with friends and looks forward to future interactions, THEN extraversion is likely High because it reflects a desire for social engagement.', 'IF a person shares enjoyment from reminiscing about past friendships but doesn’t show eagerness for new social interactions in their post THEN extraversion is likely Low because it implies comfort in familiarity rather than a drive for new social experiences.', 'IF a person indicates plans and priorities focused on a partner rather than broader social gatherings in their post THEN extraversion is likely Low because it reflects a more personal and less socially expansive outlook.']","[""having a brill time at the reunion, saw lots of faces i've not seen in a longggggg time."", 'just waiting for the karaoke to begin so i can impress everyone with a bit of Enrique!', 'Talking about old times at school was a blast....rekindled many good memories.', ""Happy Birthday to Khaleesy ! Hope you liked the flowers babe, I'll see you when I get home ....expect the princess treatment !!! love you  xxxxx""]",High,"{'Sociability': 3, 'Uncategorized': 1}",1
14,"Times Like This??Life can be complicated, but my people make it all worth it. My loved ones are what keep me going. Whether we go for drinks, go out to eat, or are just kicked back smoking and talking. I don't know where I would be without them. I'm so blessed to be able to call you guys my family. All glory to God.",HAPPY BIRTHDAY BABYGIRL????I am so proud of you for making it another year. Even when times are tough you always keep that spark. I love you so much. You really show me what real love is. I don't know where I'd be without you. Another year and forever to go for us baby. I love you so much and I'm so blessed to have you.,High,"['IF a person describes enjoying going out with a group of friends and engaging in social activities positively in their post THEN extraversion is likely High because they show enthusiasm for social interactions.', 'IF a person reflects on having shared meaningful moments with their partner and shows a lack of social enthusiasm in their post THEN extraversion is likely Low because it suggests a preference for deep, intimate connections over wider social interactions.']","['Whether we go for drinks, go out to eat, or are just kicked back smoking and talking.', ""I love you so much and I'm so blessed to have you.""]",Moderate,"{'Sociability': 1, 'Warmth': 1}",0
16,"went to a great birthday party today at the drummond park animal experience
centre with ash, jen, jodie jake, alex and all the rest of the crew.  loved watching the
monkeys antics.  the lion cubs were so cute.  alex ate too much cake and looked alittle
green jake punched him in the stomach to sicee if he could make him sick ..","wow!  another landmark birthday.  we are all so looking forward to your birthday
bash at Fisher's restaurant.  can't believe you've come this far despite all the
hoops you've had to jump through in the past few years,  what an achievement
well done you.  I know you said no presents but well suspect there may still be one or two surprises",Low,"['IF a person describes enjoying going out with a group of friends and engaging in social activities positively in their post THEN extraversion is likely High because they show enthusiasm for social interactions.', 'IF a person describes enjoying going out with a group of friends and engaging in social activities positively in their post THEN extraversion is likely High because they show enthusiasm for social interactions.']","['went to a great birthday party today at the drummond park animal experience centre with ash, jen, jodie jake, alex and all the rest of the crew.', ""we are all so looking forward to your birthday bash at Fisher's restaurant.""]",High,{'Sociability': 2},0
18,"School reunion gathering, fun night with all. Lots of laughs and embarrassing stories which may or may not have been true. It was great to catch up with everyone again after so long. Let's not leave it so long next time. Here's to being not to old to dance the night away in true school disco style.","He has finally made it another year older. I don't know how he has reached this great milestone—happy Birthday to the three-score and ten-year-old man I love. It would not be your birthday without a post like this. Your turn next to embarrass me. Here to cake, fizz and a fun-filled day of surprises.",Low,"['IF a person describes enjoying going out with a group of friends and engaging in social activities positively in their post THEN extraversion is likely High because they show enthusiasm for social interactions.', 'IF a person describes enjoying going out with a group of friends and engaging in social activities positively in their post THEN extraversion is likely High because they show enthusiasm for social interactions.', 'IF a person indicates plans and priorities focused on a partner rather than broader social gatherings in their post THEN extraversion is likely Low because it reflects a more personal and less socially expansive outlook.', 'IF a person indicates plans and priorities focused on a partner rather than broader social gatherings in their post THEN extraversion is likely Low because it reflects a more personal and less socially expansive outlook.']","['School reunion gathering, fun night with all. Lots of laughs and embarrassing stories which may or may not have been true.', ""Here's to being not to old to dance the night away in true school disco style."", 'happy Birthday to the three-score and ten-year-old man I love.', 'It would not be your birthday without a post like this.']",High,{'Sociability': 4},0
20,"Wow. Having a great time catching up with old childhood friends after over 50 years! We haven't changed a bit ????.  Other than having several marriages, 18 children and 7 grandchildren between us. Life has definitely been a journey and pretty good to all of us ??. Lets not leave it another 50 years to catch up ??",Happy Birthday to this amazing man who I'm so proud to call my husband and father of my chidren. Hope you have an absolutely brilliant day and so glad i get to share it with you. You're definitely like a fine wine and get better and better with each passing year. All my love forever and always ?,High,"['IF a person discusses the past without a sense of excitement for future social gatherings in their post THEN extraversion is likely Low because it indicates a tendency towards being reflective rather than socially engaged.', 'IF a person reflects on having shared meaningful moments with their partner and shows a lack of social enthusiasm in their post THEN extraversion is likely Low because it suggests a preference for deep, intimate connections over wider social interactions.']","['Wow. Having a great time catching up with old childhood friends after over 50 years!', ""Happy Birthday to this amazing man who I'm so proud to call my husband and father of my children.""]",Low,"{'Sociability': 1, 'Warmth': 1}",0
24,"Had the best time ca tching up with my chilidhood friends last night! It’s amazing how, despite t he years, we fall riight back into those silly jokes and shared memories. From playing games in the backyard to reminis cing about our wild adventures, it was a great reminder of the b onds that shaped us","Happy Birtihday to the love of my life! i’m so grateful for every moment we share together. You bring so mucih joy and laughter into my world. I can’t wait to celebrate you today and make more amazinng memories! Here’s to another year of love, adventure, and all your dreams coming true. You deserve the best!",High,"['IF a person reflects on having shared meaningful moments with their partner and shows a lack of social enthusiasm in their post THEN extraversion is likely Low because it suggests a preference for deep, intimate connections over wider social interactions.', 'IF a person shares enjoyment from reminiscing about past friendships but doesn’t show eagerness for new social interactions in their post THEN extraversion is likely Low because it implies comfort in familiarity rather than a drive for new social experiences.']","['Happy Birthday to the love of my life! I’m so grateful for every moment we share together.', 'Had the best time catching up with my childhood friends last night! It’s amazing how, despite the years, we fall right back into those silly jokes and shared memories.']",Low,"{'Warmth': 1, 'Sociability': 1}",0
26,"Loved loved loved seeing these guys today…the original OG’s from way back when I still had a fringe, wore double denim and was reading Shout magazine. Wah life goes by so fast.
I’m so lucky to have these guys still in my life today, we need to make these meet ups a more regular thing!","Happy Birthday to our one and only, our jam in the sandwich… have the best day. Me and the boys will be on our best behaviour today so get some rest and do something you enjoy. We love you along with everyone else who knows you. Wishing you the best of health wealth and happiness.",High,"['IF a person describes enjoying going out with a group of friends and engaging in social activities positively in their post THEN extraversion is likely High because they show enthusiasm for social interactions.', 'IF a person expresses enthusiasm for celebrations and wishes others well in a social context, THEN extraversion is likely High because it shows a positive engagement with social relationships.']","['Loved loved loved seeing these guys today…the original OG’s from way back when... we need to make these meet ups a more regular thing!', 'Happy Birthday to our one and only, our jam in the sandwich… have the best day.']",High,"{'Sociability': 1, 'Uncategorized': 1}",1
27,"After all these years it's very interesting seeing how everyone I grew up with has changed, it's almost as if I was talking to two different versions of people from parallel universes, one a complete immature and incompetent buffon, the other a sophisticated and well mannered individual. It's crazy how time flies!","From cheerleader to married, I'm so appreciative of all the things you have done for me, and our family. Helping us financially or help cope with illness, I knew I made the right decision engaging with a nurse.I'm so glad that you came into my life and that we'll one day exit together. Happy 26th birthday my love!",Low,"['IF a person discusses the past without a sense of excitement for future social gatherings in their post THEN extraversion is likely Low because it indicates a tendency towards being reflective rather than socially engaged.', 'IF a person reflects on having shared meaningful moments with their partner and shows a lack of social enthusiasm in their post THEN extraversion is likely Low because it suggests a preference for deep, intimate connections over wider social interactions.']","[""After all these years it's very interesting seeing how everyone I grew up with has changed..."", ""I'm so appreciative of all the things you have done for me, and our family.""]",Low,"{'Sociability': 1, 'Warmth': 1}",1
30,"What a weekend we have just had catching up with my childhood friends. The sun made a special appearance for us and it felt like the gods were looking out for us!

We ate, drank, laughed and shopped our hearts out.

Thank you for this special time together and can’t wait to do this again ????????","Happy birthday to you, my wonderful husband. Can’t wait to shower you with your gifts and take you out and celebrate you. We will go to your favourite restaurant ??

Congratulations ?? on this your special birthday ?? ?? let’s have lots of funnnnn!!

Love you very much, see you later my darling xxxxx",Low,"['IF a person describes enjoying going out with a group of friends and engaging in social activities positively in their post THEN extraversion is likely High because they show enthusiasm for social interactions.', 'IF a person indicates plans and priorities focused on a partner rather than broader social gatherings in their post THEN extraversion is likely Low because it reflects a more personal and less socially expansive outlook.']","['What a weekend we have just had catching up with my childhood friends. The sun made a special appearance for us and it felt like the gods were looking out for us! We ate, drank, laughed and shopped our hearts out.', 'Happy birthday to you, my wonderful husband. Can’t wait to shower you with your gifts and take you out and celebrate you.']",High,{'Sociability': 2},0
31,Long awaited catch up with life long friends!  Why has it taken so long? It was so good to catch up with everybody.  It has been so great seeing how we have all changed and grown both physically and spiritually.  Let me know who is up for making this an annual event? Please let me know.  I am happy to organise it.  Feeling blessed.  Cheers everyone!,"Happy birthday to the best and most wonderful husband I could ever ask for xx  Thank you for everything you do. Thank you for being an awesome dad to our two children. Enjoy your day and look forward the birthday celebrations tonight.  Enjoy your gifts. 
 You  so deserve them.  Love as always.",High,"['IF a person describes enjoying going out with a group of friends and engaging in social activities positively in their post THEN extraversion is likely High because they show enthusiasm for social interactions.', 'IF a person indicates plans and priorities focused on a partner rather than broader social gatherings in their post THEN extraversion is likely Low because it reflects a more personal and less socially expansive outlook.']","['Long awaited catch up with life long friends! ... It was so good to catch up with everybody.', 'Happy birthday to the best and most wonderful husband I could ever ask for xx ... Enjoy your day and look forward the birthday celebrations tonight.']",High,{'Sociability': 2},1
32,"A great thank you to my best childhood friends for organising this heart-warming event.
Emily, Sandra and Beckie - you are the best! 
Lots of stories and pictures were shared and we all thoroughly enjoyed a crazy ride down memory lane. It was great to see you all and see how you all got on in your lives girls!
Can't wait to do this again next year!","A very Happy birthday to my bestie!!! Roy, I want you to know that you are the best thing that ever happened to me. I am so glad we met and I love you unconditionally. I hope you have the best day celebrating your 40th birthday and I'm so here for it. 
You have touched the lives of so many people including mine and we are forever grateful for your optimistic, caring, and kind personality, hope you'll never change!
",Moderate,"['IF a person describes enjoying going out with a group of friends and engaging in social activities positively in their post THEN extraversion is likely High because they show enthusiasm for social interactions.', 'IF a person shares enjoyment from reminiscing about past friendships but doesn’t show eagerness for new social interactions in their post THEN extraversion is likely Low because it implies comfort in familiarity rather than a drive for new social experiences.', 'IF a person indicates plans and priorities focused on a partner rather than broader social gatherings in their post THEN extraversion is likely Low because it reflects a more personal and less socially expansive outlook.']","['A great thank you to my best childhood friends for organising this heart-warming event. Lots of stories and pictures were shared and we all thoroughly enjoyed a crazy ride down memory lane.', ""It was great to see you all and see how you all got on in your lives girls! Can't wait to do this again next year!"", ""I hope you have the best day celebrating your 40th birthday and I'm so here for it.""]",High,{'Sociability': 3},0
33,Back with the besties! Hanging with my buds from grade school… can’t believe how long it’s been. After all this time they all still get it. Anyone who want to get a drink come on by. High school may have been fifteen years ago but it still feels like we graduated just yesterday. ,Happy birthday to my best friend and partner in crime. It’s crazy all we’ve been through in the past fifteen years. Through all the ups and downs you have always been there for me. I couldn’t ask for a better person to share my life with. Happy birthday and here’s to the next decade together. ,Low,"['IF a person describes enjoying going out with a group of friends and engaging in social activities positively in their post THEN extraversion is likely High because they show enthusiasm for social interactions.', 'IF a person shares enjoyment from reminiscing about past friendships but doesn’t show eagerness for new social interactions in their post THEN extraversion is likely Low because it implies comfort in familiarity rather than a drive for new social experiences.', 'IF a person indicates plans and priorities focused on a partner rather than broader social gatherings in their post THEN extraversion is likely Low because it reflects a more personal and less socially expansive outlook.']","['Back with the besties! Hanging with my buds from grade school… can’t believe how long it’s been.', 'High school may have been fifteen years ago but it still feels like we graduated just yesterday.', 'Happy birthday to my best friend and partner in crime. It’s crazy all we’ve been through in the past fifteen years.']",High,{'Sociability': 3},0
