p,post1,post2,true_label,matched_rules,matched_behaviours,pred_rule_based,category_counts,score_rules
2,"Such a great night with this incredible bunch, but I'm feeling it this morning! Everyone needs those friends who know you so well, who'll see you through anything and everything. And no matter how old we get are still up for a good girls night out, even if it now takes us two days to recover! Night at Sixways is always the best, love this place, and Love you all ???? ","It's official, he's getting older! Happy birthday to my gorgeous husband, another year old and not any wiser! The kindest, funniest soul I will ever meet, and the most amazing dog Dad you could ever find. Looking forward to spoiling you rotten today - and maybe a few surprises this weekend! Happy birthday favourite human xoxo",High,"['IF a person shows in a post a tendency to mention feeling awkward or uncomfortable in social settings, THEN extraversion is likely Low because it highlights a struggle with social interactions.']",['nothing in the posts indicates feeling awkward or uncomfortable in social settings.'],High,{'Uncategorized': 1},1
5,"Lovely to catch up with some old friends and reminisce on childhood memories! It's crazy to see how much everybody has grown and achieved in life and where their paths have taken them. I love days like these, hope to catch up with you all again sometime soon and make more brilliant memories ??","To the love of my life, I hope you have the best day and make the best memories! Thank you for making the world a happier place and staying by my side. I'd be lost without you, don't ever change! I love you with all of my heart, always ?? happy birthday my love, here is to many more together xxx",Low,[],[],High,{},0
6,today guys I have reunited with my childhood friends and I was so excited. it was an amazing experience which I totally recommend if you can do it as the feeling of meeting someone you used to play with when you talked to them is unforgettable. Also the fact that you used to be so close with them is shocking!,"Happy birthday dear. I am so happy to see you growing up bit by bit. I always see that amazing special smile once a year, unique from the others and that makes me overjoyed. I wish you the best of many days and years to come and I hope you find my gifts splendid aswell as everyone elses.",High,"['IF a person talks about feeling excited during social reunions, THEN extraversion is likely High because it shows enjoyment and positivity in social interactions.', ""IF a person expresses happiness about someone's birthday and reflects on their special qualities, THEN extraversion is likely High because this demonstrates social engagement and appreciation for others.""]","['I have reunited with my childhood friends and I was so excited. it was an amazing experience.', 'I am so happy to see you growing up bit by bit. I wish you the best of many days and years to come.']",High,{'Uncategorized': 2},1
7,"Had a lovely time with the girls today, we went to our favourite childhood restaurant. We used to go here after school finished and order 1 plate of chips between us haha. 15 years of friendship down, a lifetime to go. I know our teachers that told us we spoke too much in class are mad haha.",My lover my lover. Happy Birthday to you. You're getting old but at least you still look fly haha. I hope you have a fabulous day today filled with love and joy and many more birthdays.  You're truly one of a kind. I love you dearly and cant wait to spend the rest of the day with you.,High,[],[],High,{},1
9,"Day 1s! 
We finally met up after so long - It was so lovely to catch up with all of you. It has been way too long since we last saw each other, and it really good to hear that you're all doing well. So much has changed since we used to see each other daily, but somehow it feels like no time has passed when we got back togehter
Let me know when you're all back in town - we can hang out again.","Happy birthday!!
I hope you had an amazing day with friends and family - and thank you for letting me share it with you. I'm so proud of all you've achieved this past year. It has been full of many great times and I'm sure the next year will be full of lots of new opportunities. I look forward to spending the next year with you 
See you later today!",Moderate,"['IF a person talks about being excited to share new plans and experiences, THEN extraversion is likely High because this reflects an eagerness to explore and connect with others.', 'IF a person demonstrates enthusiasm for upcoming plans with friends, THEN extraversion is likely High because this reflects a desire for new experiences and social connections.']","[""It was so lovely to catch up with all of you. Let me know when you're all back in town - we can hang out again."", 'I look forward to spending the next year with you. See you later today!']",High,{'Uncategorized': 2},0
10,"having a brill time at the reunion, saw lots of faces i've not seen in a longggggg time. we mustn't leave it so long next time. just waiting for the karaoke to begin so i can impress everyone with a bit of Enrique ! I hope everyone doesn't leave the room when I start singing otherwise i'll never dare pick up a microphone ever again.  Talking about old times at school was a blast....rekindled many good memories.","Happy Birthday to Khaleesy ! Hope you liked the flowers babe, I'll see you when I get home ....expect the princess treatment !!! love you  xxxxx

You always say that my messages on here are too short so i'm making an effort to write you a longgggggggggggggggggg one this time hahaha

happy birthday to you, happy birthday to you, happy birthday Khaleesy, Happy Birthday too youuuuuuuuuuuuuu....uuuuuuuu xxxxx",High,"['IF a person shows in a post a tendency to mention feeling awkward or uncomfortable in social settings, THEN extraversion is likely Low because it highlights a struggle with social interactions.']","[""I hope everyone doesn't leave the room when I start singing otherwise i'll never dare pick up a microphone ever again.""]",Moderate,{'Uncategorized': 1},0
11,"Hey guys!!!
guess who we have here today???

My childhood friends came over. Oh my God, i have really missed them, i saw them last about 8 years ago but we've always been in communication. I'm so happy to see them and i can't wait to update you guys on the plans we have to catch up. 
Stay tuned!","Happy birthday to the love of my life. I can't imagine what my life could have been without you, you brought colors into my life. On this big day of yours, i wish you heavens choicest blessings and i pray all your hear desires are granted. I love you so much and i hope i make you happy as much as you make me",Low,"['IF a person talks about being excited to share new plans and experiences, THEN extraversion is likely High because this reflects an eagerness to explore and connect with others.', 'IF a person expresses strong positive emotions and affection towards someone publicly, THEN extraversion is likely High because it indicates comfort in sharing personal feelings.']","[""I'm so happy to see them and i can't wait to update you guys on the plans we have to catch up."", ""Happy birthday to the love of my life. I can't imagine what my life could have been without you, you brought colors into my life.""]",High,{'Uncategorized': 2},0
12,"Had a great catch up with my old school pals. 
Dinner was lovely and lots of laughs and drinks as usual! Always great to see them and amazing that we are all still friends after over 30 years.
Can't wait until the next one in December . Hope everyone can make it as it's going to be a special trip!","Wishing you the happiest of birthdays. You deserve to have the best day!
Thanks for being the most amazing and supportive partner.
We all appreciate everything you do for us .
We hope you love your surprise party .. you won't read this until after , so it's safe to write this :-) Lots of love ...",Moderate,"['IF a person shows in a post a tendency to mention feeling awkward or uncomfortable in social settings, THEN extraversion is likely Low because it highlights a struggle with social interactions.']",['No evidence of feeling awkward or uncomfortable in the posts.'],High,{'Uncategorized': 1},0
15,"Just got back from a reunion with some friends from back home! These guys always had my back, except when it comes to telling me I'm any good at bowling or mini golf :0 Then again, the drinks probably messed my aim up a litttle bit. Hope to see you guys soon!! Keep it real @xComedyCheesex @Crazygamer05 @7evenup","To this beautiful girl who was a stranger up until 10 months ago, happy birthday my love, I hope that we can spend many more together! P.S. Don't tell anyone I forgot the cake and had to ask you to bake us another one to save myself from the embarassment. Love you lots! Have the best birthday ever &lt;3",High,"['IF a person shows in a post a tendency to mention feeling awkward or uncomfortable in social settings, THEN extraversion is likely Low because it highlights a struggle with social interactions.']",['I forgot the cake and had to ask you to bake us another one to save myself from the embarassment.'],Low,{'Uncategorized': 1},0
16,"went to a great birthday party today at the drummond park animal experience
centre with ash, jen, jodie jake, alex and all the rest of the crew.  loved watching the
monkeys antics.  the lion cubs were so cute.  alex ate too much cake and looked alittle
green jake punched him in the stomach to sicee if he could make him sick ..","wow!  another landmark birthday.  we are all so looking forward to your birthday
bash at Fisher's restaurant.  can't believe you've come this far despite all the
hoops you've had to jump through in the past few years,  what an achievement
well done you.  I know you said no presents but well suspect there may still be one or two surprises",Low,"['IF a person shows in a post a tendency to mention feeling awkward or uncomfortable in social settings, THEN extraversion is likely Low because it highlights a struggle with social interactions.']",['There are no mentions of feeling awkward or uncomfortable in social settings in the posts.'],Low,{'Uncategorized': 1},1
17,"Finally! The stars aligned and we were able to go out together! What a wild time we've had, you would think that we were in 2004 living our best life at XXX university! The venue was just perfect, and by the look of the videos, despite turning 40 we can still bust a move like when we were 20! ","My darling partner, wishing you the best birthday ever (yet!). Just like fine wine you've aged amazingly well, the salt and pepper look really becomes you! I hope you will enjoy the celebrations we planned for you today, fear not we'll keep it low key and definitely not party like we did for your thirtieth!",High,"['IF a person shows in a post a tendency to mention feeling awkward or uncomfortable in social settings, THEN extraversion is likely Low because it highlights a struggle with social interactions.']",['N/A'],High,{'Uncategorized': 1},1
18,"School reunion gathering, fun night with all. Lots of laughs and embarrassing stories which may or may not have been true. It was great to catch up with everyone again after so long. Let's not leave it so long next time. Here's to being not to old to dance the night away in true school disco style.","He has finally made it another year older. I don't know how he has reached this great milestone—happy Birthday to the three-score and ten-year-old man I love. It would not be your birthday without a post like this. Your turn next to embarrass me. Here to cake, fizz and a fun-filled day of surprises.",Low,"['IF a person shows in a post a tendency to mention feeling awkward or uncomfortable in social settings, THEN extraversion is likely Low because it highlights a struggle with social interactions.']",['None of the posts show feelings of awkwardness or discomfort in social settings.'],High,{'Uncategorized': 1},0
19,"So exciting to catch up with everyone! Being in our thirties means meeting up takes at least ten conversations about the event, at least one cancellation, minimum two babies and a stray husband. Glad this one made it out of the group chat. To next time; hopefully it doesn't take eight months ;)","Turning 30 has never looked better. Spending our twenties together was incredible; the highs, the lows, but most importantly being with you. So excited to spend the rest of my life with you. Happy birthday to the love of my life. You have changed my life in the most incredible way and you are so special to me. Cheers to my favourite person. I love you.",Moderate,"['IF a person shows in a post a tendency to mention feeling awkward or uncomfortable in social settings, THEN extraversion is likely Low because it highlights a struggle with social interactions.']",['No evidence of feeling awkward or uncomfortable in social settings.'],High,{'Uncategorized': 1},0
20,"Wow. Having a great time catching up with old childhood friends after over 50 years! We haven't changed a bit ????.  Other than having several marriages, 18 children and 7 grandchildren between us. Life has definitely been a journey and pretty good to all of us ??. Lets not leave it another 50 years to catch up ??",Happy Birthday to this amazing man who I'm so proud to call my husband and father of my chidren. Hope you have an absolutely brilliant day and so glad i get to share it with you. You're definitely like a fine wine and get better and better with each passing year. All my love forever and always ?,High,"['IF a person shows in a post a tendency to mention feeling awkward or uncomfortable in social settings, THEN extraversion is likely Low because it highlights a struggle with social interactions.']",['N/A'],High,{'Uncategorized': 1},1
22,"It had been a long time coming, I met my childhood friends after nearly 10 years. We certainly had plenty of banter and catch up talk to go through. It is amazing how we have all gone down different routes yet have had similar childhood experiences. It was also interesting how our personality traits are still noticeable from all that time ago. ",Happy Birthday! Many happy returns and I hope you have a wonderful dream fulled day! Looking forward to going out to celebrate your Birthday. Hope you liked all your presents. I am sure it will be a day to remember with all the celebrations. Love you loads and wishing you all the best. ,Low,"['IF a person shows in a post a tendency to mention feeling awkward or uncomfortable in social settings, THEN extraversion is likely Low because it highlights a struggle with social interactions.']",['No evidence of feeling awkward or uncomfortable in social settings was detected in the posts.'],Moderate,{'Uncategorized': 1},0
23,An unforgettable day with childhood friends! A magical day reminicising together and catching up after so long. Doesn’t matter how long it’s been we all slot back together like no time has passed at all. Watching our kids play together and seeing the cycles of life begin all over again is so emotional. Love you all xx #westhillgang #pyegreenmassive #childhood #friends,"Happy Birthday to my best friend, the best husband and dad in the world! I’ve celebrated 13 of your birthdays with you and every day in between and for all the chats and hugs, the love, the tough times, it is never ever enough. I look forward to seeing you every morning, I can’t wait to see you after work every day. The love of my life, I am so in love with you. Happy Birthday, my love xxx",Low,"['IF a person shows in a post a tendency to mention feeling awkward or uncomfortable in social settings, THEN extraversion is likely Low because it highlights a struggle with social interactions.']",['None of the posts indicate any feelings of awkwardness or discomfort in social settings.'],High,{'Uncategorized': 1},0
25,"Was lucky enough to recently meet up and have an amazing time catching up with old friends from school who I hadn't seen in years, these are the people who made my childhood and shaped me into the person i am now so to see them all again and share memories was unbelievable, hopefully do it again soon","Happy birthday to my amazing partner, hope you have an fantastic day, thank you for everything you have done for me since the first moment I met you and putting up with me all the time, wishing you an amazing day and I've got a lot planned that will hopefully give you the day you deserve and to spoil you ",Moderate,[],[],High,{},0
28,My oldest and dearest friends gathered at the weekend to celebrate 30 years since leaving school. Much laughing and getting over how much we had all aged. Looking back at our old school photos was hilarious. Some of us didn't even recognise ourselves. We had such a good time that we decided to make this an annual event ,The most important person in my life achieves a milestone birthday today. Congratulations on your 50th and may we share many more happy years together. Unfortunately it's all downhill from here. Buckle up for the coming mid life crisis and keep smiling. These can be the best years of life with the right attitude. Get writing that bucket list and let's see the world ticking them off.,Low,[],[],Moderate,{},0
31,Long awaited catch up with life long friends!  Why has it taken so long? It was so good to catch up with everybody.  It has been so great seeing how we have all changed and grown both physically and spiritually.  Let me know who is up for making this an annual event? Please let me know.  I am happy to organise it.  Feeling blessed.  Cheers everyone!,"Happy birthday to the best and most wonderful husband I could ever ask for xx  Thank you for everything you do. Thank you for being an awesome dad to our two children. Enjoy your day and look forward the birthday celebrations tonight.  Enjoy your gifts. 
 You  so deserve them.  Love as always.",High,[],[],High,{},1
34,"just been to a reunion with my childhood friends and it was a great night and i would like to thank them all for great night.
 it brought back some good memorys and good times. at least this time we got drunk legally and didn't have to run off when we got caught.
i think we  should all do it again in the very near future. ","i would like to wish my better half a very happy birthday and i hope you have a very good day. you are the best thing that ever happened to me and i would be lost with out you.
 i've got a few special things planned for us to do for your birthday and i hope you will enjoy yourself.
",Moderate,"['IF a person shows in a post a tendency to mention feeling awkward or uncomfortable in social settings, THEN extraversion is likely Low because it highlights a struggle with social interactions.']",['No evidence of feeling awkward or uncomfortable in social settings is present in the posts.'],Moderate,{'Uncategorized': 1},1
35,Had a great catchup with my old friends today. It had been too long since we had last spoke with each other. Met up at a local pub and had some nice drinks and a great dinner. There was a show on across the road and we jumped over there after a few beers. Thanks for organising it guys and let's not wait too long for the next one! ,"Happy birthday, babe! Where has the year gone? It felt like only last month we were talking about our plans for the year and now nearly a whole other year has gone by. Don't feel too worked up about your age because I know it gets to you, sometimes. We'll go out and enjoy ourselves and treat it like an 18th to make you happy. Remember, it's better to be over the hill than buried under it.",High,"['IF a person shows in a post a tendency to mention feeling awkward or uncomfortable in social settings, THEN extraversion is likely Low because it highlights a struggle with social interactions.']",['No evidence of feeling awkward or uncomfortable in social settings.'],High,{'Uncategorized': 1},1
36,"I had the best time today, joining together with the girls I grew up with! We shared memories, laughed at our ridiculous behaviour (and outfits, though the less said about that, the better!). It was utterly joyful, and a real throwback to a much simpler time. Like therapy for the soul. I'm very excited to do it again very soon.","I've never made a secret of how proud I am of my husband. I'm his biggest cheerleader and No.1 fan! As he approaches his 40th birthday, I want to thank him for our last 20 years together and congratulate him on every single achievement in his life! His children, his dedication to helping others and his commitment to being the best person he can be. So proud of you, darling! Love you lots xx",High,"['IF a person shows in a post a tendency to mention feeling awkward or uncomfortable in social settings, THEN extraversion is likely Low because it highlights a struggle with social interactions.']",['None.'],High,{'Uncategorized': 1},1
37,"After some years, I was finally able to spend some time with my old pal X from back home. It feels unreal to spend time with them after so many years spent apart and after so many things happened, whether it was moving abroad, new jobs or big family events. X you mean a lot and I cherish our friendship ","I still can't express how lucky I am to have you in my life, ever since I met you, you have been a integral part of my life and I can't express how much you mean to me and how much I love you. Happy birthday, I really mean that, wish you a happy birthday and may the years be kind to us",Moderate,"['IF a person shows in a post a tendency to mention feeling awkward or uncomfortable in social settings, THEN extraversion is likely Low because it highlights a struggle with social interactions.']","['No explicit mention of feeling awkward or uncomfortable was made, but the focus on deep and meaningful connections suggests difficulty in wider social settings.']",Low,{'Uncategorized': 1},0
43,"Good to finally get back together with the crew haha, been a long time coming but definitely worth the wait. All those memories, all the good times and the best part about it, we get to recreate those memories and relive them every time we talk about them. Good to see everytime. Until the next time!","Happy birthday to the most gorgeous girl i've ever laid eyes on in my entire life. I always felt as though i was missing something in life, and now that i've found you i finally feel whole. I hope you have the best day and i hope you get everything you want out of life. Love you. I'll be raising a glass today, To more happiness and more memories!",Low,"['IF a person shows in a post a tendency to mention feeling awkward or uncomfortable in social settings, THEN extraversion is likely Low because it highlights a struggle with social interactions.']",['N/A'],High,{'Uncategorized': 1},0
49,"Saw one of my very good friends today! It was quite nostalgic; all those laughter and stories we never get to tell anyone else. He began kidding around and it was like, no time had elapsed and we were back in our childhood or teenage years telling stories of the places we used to hang around. One thing I’ve always grown to appreciate is the ability of friends to know you when you were still young and still support you to date. Thank you to people like this and for creating so many more wonderful memories! Cheers to the uncovered moments.  #Tbt #blessedfriends ","It is another great day for the love of my life, Happy Birthday to you! Today i celebrate you. You always bring so much joy and happiness in to my life, not to mention the patient and constant support. Thanks for every day, all the fun we have, the trips we take, the moments that matters to each of us. Happy anniversary to us yet again, Cheers to many more impressive years together by our side. Happy birthday to you and lots of happiness that you will be showered with today! #BirthdayWishes #BirthdayBoy ",Moderate,"['IF a person shows in a post a tendency to mention feeling awkward or uncomfortable in social settings, THEN extraversion is likely Low because it highlights a struggle with social interactions.']",['N/A'],High,{'Uncategorized': 1},0
50,"What a blast from the past it was last night!   50 years since we all left Morgan and went out into the big wide world.   It was amazing to see some of the old faces, some I barely recognised while with others we went straight back to third year French class!  Awesome to catch up with Brucie, Govie and Tich, but sobering to hear about those who are no longer with us.   Be grateful for every day.","Woo hoo!  Bill is 70!   How did I come to be married to such an old man???   Thank you for putting up with me for all these years and am looking forward to celebrating with you tonight.  Play your cards right - I might just have a wee surprise for you later on!  In the meantime enjoy your cake, it's your favourite!",Low,"['IF a person shows in a post a tendency to mention feeling awkward or uncomfortable in social settings, THEN extraversion is likely Low because it highlights a struggle with social interactions.']",['There is no mention of feeling awkward or uncomfortable in social settings in the provided posts.'],Moderate,{'Uncategorized': 1},0
