p,post1,post2,true_label,matched_rules,matched_behaviours,pred_rule_based,category_counts,score_rules
30,"What a weekend we have just had catching up with my childhood friends. The sun made a special appearance for us and it felt like the gods were looking out for us!

We ate, drank, laughed and shopped our hearts out.

Thank you for this special time together and can’t wait to do this again ????????","Happy birthday to you, my wonderful husband. Can’t wait to shower you with your gifts and take you out and celebrate you. We will go to your favourite restaurant ??

Congratulations ?? on this your special birthday ?? ?? let’s have lots of funnnnn!!

Love you very much, see you later my darling xxxxx",Low,"['IF a person expresses enthusiasm for meeting up with a group of friends and shows eagerness to organize future gatherings in a post, THEN extraversion is likely High because it indicates they enjoy socializing and are proactive in their relationships.', 'IF a person uses vivid and energetic language to describe a fun event with multiple friends and expresses excitement about the experience, THEN extraversion is likely High because it shows they derive joy and energy from social interactions.', 'IF a person makes plans or expresses an eagerness to meet with friends in a social context and comments positively about shared experiences, THEN extraversion is likely High because it signifies a preference for social interaction over solitude.', 'IF a person discusses feeling enthusiastic about celebrating a special occasion and expresses excitement for shared experiences, THEN extraversion is likely High because it indicates they value social interactions.']","['can’t wait to do this again', 'We ate, drank, laughed and shopped our hearts out.', 'Thank you for this special time together and can’t wait to do this again', 'Can’t wait to shower you with your gifts and take you out and celebrate you.']",High,"{'Sociability': 2, 'Positive Emotions': 1, 'Uncategorized': 1}",0
