p,post1,post2,true_label,matched_rules,matched_behaviours,pred_rule_based,category_counts,score_rules
1,OMG we went to the movie theater and watched a new movie and had fun there was a cute boy a few rolls up from us and we was throwing popcorn at him to get his attention he met us outside after the movies and we talked and exchanged phone numbers and we've been talking ever since me and my friends enjoyed this night,I just want to shout out happy birthday to my amazing husband he always does everything for us and gets up and goes to work and works hard everyday to provide everything that we need I just want to say I'm so grateful for him and everything he has done for me and our children and I will continue to be grateful everyday,High,"['IF a person expresses enthusiasm for meeting up with a group of friends and shows eagerness to organize future gatherings in a post, THEN extraversion is likely High because it indicates they enjoy socializing and are proactive in their relationships.', 'IF a person uses vivid and energetic language to describe a fun event with multiple friends and expresses excitement about the experience, THEN extraversion is likely High because it shows they derive joy and energy from social interactions.', 'IF a person makes plans or expresses an eagerness to meet with friends in a social context and comments positively about shared experiences, THEN extraversion is likely High because it signifies a preference for social interaction over solitude.']","['we went to the movie theater and watched a new movie and had fun', 'we was throwing popcorn at him to get his attention... me and my friends enjoyed this night', ""we talked and exchanged phone numbers and we've been talking ever since""]",High,"{'Sociability': 2, 'Positive Emotions': 1}",1
2,"Such a great night with this incredible bunch, but I'm feeling it this morning! Everyone needs those friends who know you so well, who'll see you through anything and everything. And no matter how old we get are still up for a good girls night out, even if it now takes us two days to recover! Night at Sixways is always the best, love this place, and Love you all ???? ","It's official, he's getting older! Happy birthday to my gorgeous husband, another year old and not any wiser! The kindest, funniest soul I will ever meet, and the most amazing dog Dad you could ever find. Looking forward to spoiling you rotten today - and maybe a few surprises this weekend! Happy birthday favourite human xoxo",High,"['IF a person expresses enthusiasm for meeting up with a group of friends and shows eagerness to organize future gatherings in a post, THEN extraversion is likely High because it indicates they enjoy socializing and are proactive in their relationships.', 'IF a person reflects positively on shared memories with friends and expresses a desire to continue forming memories in the future, THEN extraversion is likely High because it suggests they are comfortable and engaged in social settings.', 'IF a person makes plans or expresses an eagerness to meet with friends in a social context and comments positively about shared experiences, THEN extraversion is likely High because it signifies a preference for social interaction over solitude.', 'IF a person uses vivid and energetic language to describe a fun event with multiple friends and expresses excitement about the experience, THEN extraversion is likely High because it shows they derive joy and energy from social interactions.']","[""Such a great night with this incredible bunch, but I'm feeling it this morning!"", ""Everyone needs those friends who know you so well, who'll see you through anything and everything."", 'Night at Sixways is always the best, love this place, and Love you all.', 'and no matter how old we get are still up for a good girls night out, even if it now takes us two days to recover!']",High,"{'Sociability': 2, 'Warmth': 1, 'Positive Emotions': 1}",1
3,"We spent the evening around my house, me and my 4 friends. We love spending time together and chilling out. Once they came here we spent the evening wining and dining. I must stay i think i out done myself with the cooking autumn soup with homemade bread for starters, steak and sides for main and sticky toffee pudding for dessert. Alongside we drank many bottes of wine and had many shots. Feeling it today haha!","Happy birthday, hope you have the best day ever XX I cherish all our memories together and enjoyed our 6 year relationship every day is a blessing spending it with you. Love you forever and always xx Your the most and gentle person ever and make me the happiest girl alive. The love you give me is the best",Moderate,"['IF a person expresses enthusiasm for meeting up with a group of friends and shows eagerness to organize future gatherings in a post, THEN extraversion is likely High because it indicates they enjoy socializing and are proactive in their relationships.', 'IF a person uses vivid and energetic language to describe a fun event with multiple friends and expresses excitement about the experience, THEN extraversion is likely High because it shows they derive joy and energy from social interactions.', 'IF a person reflects positively on shared memories with friends and expresses a desire to continue forming memories in the future, THEN extraversion is likely High because it suggests they are comfortable and engaged in social settings.', 'IF a person makes plans or expresses an eagerness to meet with friends in a social context and comments positively about shared experiences, THEN extraversion is likely High because it signifies a preference for social interaction over solitude.']","['We love spending time together and chilling out.', 'We spent the evening wining and dining... Feeling it today haha!', 'I cherish all our memories together and enjoyed our 6 year relationship.', 'Happy birthday, hope you have the best day ever XX... spending it with you.']",High,"{'Sociability': 2, 'Positive Emotions': 1, 'Warmth': 1}",0
4,"Wow! It's so great to see everyone after all this time! I am so excited to be here and catch up on all that we missed over time. It's great to see all these familiar faces smiling back at me! I really have missed you and seeing you here and now, I am reminded of some of the best times of my life!","Happy Birthday XXXX! Just wanted you to know I was thinking about you on your special day and wish you many more! I know that you will a wonderful journey ahead of you in days to come and I will be there to cheer you on the whole way. Enjoy your day, take some time to yourself and start back to work tomorrow. L,S",Moderate,"['IF a person expresses enthusiasm for meeting up with a group of friends and shows eagerness to organize future gatherings in a post, THEN extraversion is likely High because it indicates they enjoy socializing and are proactive in their relationships.', 'IF a person reflects positively on shared memories with friends and expresses a desire to continue forming memories in the future, THEN extraversion is likely High because it suggests they are comfortable and engaged in social settings.']","[""Wow! It's so great to see everyone after all this time! I am so excited to be here and catch up on all that we missed over time."", 'I really have missed you and seeing you here and now, I am reminded of some of the best times of my life!']",High,"{'Sociability': 1, 'Warmth': 1}",0
5,"Lovely to catch up with some old friends and reminisce on childhood memories! It's crazy to see how much everybody has grown and achieved in life and where their paths have taken them. I love days like these, hope to catch up with you all again sometime soon and make more brilliant memories ??","To the love of my life, I hope you have the best day and make the best memories! Thank you for making the world a happier place and staying by my side. I'd be lost without you, don't ever change! I love you with all of my heart, always ?? happy birthday my love, here is to many more together xxx",Low,"['IF a person reflects positively on shared memories with friends and expresses a desire to continue forming memories in the future, THEN extraversion is likely High because it suggests they are comfortable and engaged in social settings.', 'IF a person expresses enthusiasm for meeting up with a group of friends and shows eagerness to organize future gatherings in a post, THEN extraversion is likely High because it indicates they enjoy socializing and are proactive in their relationships.']","['Lovely to catch up with some old friends and reminisce on childhood memories! I love days like these, hope to catch up with you all again sometime soon and make more brilliant memories.', 'hope to catch up with you all again sometime soon and make more brilliant memories.']",Moderate,"{'Warmth': 1, 'Sociability': 1}",0
6,today guys I have reunited with my childhood friends and I was so excited. it was an amazing experience which I totally recommend if you can do it as the feeling of meeting someone you used to play with when you talked to them is unforgettable. Also the fact that you used to be so close with them is shocking!,"Happy birthday dear. I am so happy to see you growing up bit by bit. I always see that amazing special smile once a year, unique from the others and that makes me overjoyed. I wish you the best of many days and years to come and I hope you find my gifts splendid aswell as everyone elses.",High,"['IF a person expresses enthusiasm for meeting up with a group of friends and shows eagerness to organize future gatherings in a post, THEN extraversion is likely High because it indicates they enjoy socializing and are proactive in their relationships.', 'IF a person reflects positively on shared memories with friends and expresses a desire to continue forming memories in the future, THEN extraversion is likely High because it suggests they are comfortable and engaged in social settings.', ""IF a person discusses a sense of joy regarding someone's growth and conveys happiness about personal connections, THEN extraversion is likely High because it reflects a positive emotion towards social interactions.""]","['I was so excited. it was an amazing experience which I totally recommend if you can do it as the feeling of meeting someone you used to play with is unforgettable.', 'the feeling of meeting someone you used to play with when you talked to them is unforgettable.', 'I am so happy to see you growing up bit by bit. I always see that amazing special smile once a year, unique from the others and that makes me overjoyed.']",High,"{'Sociability': 1, 'Warmth': 1, 'Uncategorized': 1}",1
7,"Had a lovely time with the girls today, we went to our favourite childhood restaurant. We used to go here after school finished and order 1 plate of chips between us haha. 15 years of friendship down, a lifetime to go. I know our teachers that told us we spoke too much in class are mad haha.",My lover my lover. Happy Birthday to you. You're getting old but at least you still look fly haha. I hope you have a fabulous day today filled with love and joy and many more birthdays.  You're truly one of a kind. I love you dearly and cant wait to spend the rest of the day with you.,High,"['IF a person reflects positively on shared memories with friends and expresses a desire to continue forming memories in the future, THEN extraversion is likely High because it suggests they are comfortable and engaged in social settings.', 'IF a person mentions feeling nostalgic about past experiences with a close friend and does not express a strong desire to create new social experiences, THEN extraversion is likely Low because it indicates a preference for reminiscing rather than seeking out new social interactions.', 'IF a person describes interactions with a few chosen individuals and does not express enthusiasm or a desire to socialize with a broader group, THEN extraversion is likely Low because it suggests they are more comfortable or satisfied with intimate rather than wide-ranging social circles.']","['Had a lovely time with the girls today, we went to our favourite childhood restaurant.', '15 years of friendship down, a lifetime to go.', 'Had a lovely time with the girls today.']",Low,"{'Warmth': 1, 'Sociability': 2}",0
8,"time flies by, I cant believe its been so long since we all met,  had so much fun seeing you all again and catching up. I remember when we used to go out on our bikes for hours now we all have our own house's. its crazy. we should make this an annual thing every year. none of you have changed! ","Happpy Birthdayyyy. I hope your day is filled with all the things you love and your favorite people. This last year has been amazing and i cant wait to celebrate every birthday with you, even when we are old we'll still have each others company. Love you and cant wait to celebrate this day with you.",Moderate,"['IF a person expresses enthusiasm for meeting up with a group of friends and shows eagerness to organize future gatherings in a post, THEN extraversion is likely High because it indicates they enjoy socializing and are proactive in their relationships.', 'IF a person reflects positively on shared memories with friends and expresses a desire to continue forming memories in the future, THEN extraversion is likely High because it suggests they are comfortable and engaged in social settings.', 'IF a person makes plans or expresses an eagerness to meet with friends in a social context and comments positively about shared experiences, THEN extraversion is likely High because it signifies a preference for social interaction over solitude.']","['we should make this an annual thing every year.', 'I had so much fun seeing you all again and catching up.', 'I cant wait to celebrate every birthday with you.']",High,"{'Sociability': 2, 'Warmth': 1}",0
9,"Day 1s! 
We finally met up after so long - It was so lovely to catch up with all of you. It has been way too long since we last saw each other, and it really good to hear that you're all doing well. So much has changed since we used to see each other daily, but somehow it feels like no time has passed when we got back togehter
Let me know when you're all back in town - we can hang out again.","Happy birthday!!
I hope you had an amazing day with friends and family - and thank you for letting me share it with you. I'm so proud of all you've achieved this past year. It has been full of many great times and I'm sure the next year will be full of lots of new opportunities. I look forward to spending the next year with you 
See you later today!",Moderate,"['IF a person expresses enthusiasm for meeting up with a group of friends and shows eagerness to organize future gatherings in a post, THEN extraversion is likely High because it indicates they enjoy socializing and are proactive in their relationships.', 'IF a person reflects positively on shared memories with friends and expresses a desire to continue forming memories in the future, THEN extraversion is likely High because it suggests they are comfortable and engaged in social settings.', 'IF a person makes plans or expresses an eagerness to meet with friends in a social context and comments positively about shared experiences, THEN extraversion is likely High because it signifies a preference for social interaction over solitude.']","[""Let me know when you're all back in town - we can hang out again."", 'It was so lovely to catch up with all of you.', 'I look forward to spending the next year with you.']",High,"{'Sociability': 2, 'Warmth': 1}",0
10,"having a brill time at the reunion, saw lots of faces i've not seen in a longggggg time. we mustn't leave it so long next time. just waiting for the karaoke to begin so i can impress everyone with a bit of Enrique ! I hope everyone doesn't leave the room when I start singing otherwise i'll never dare pick up a microphone ever again.  Talking about old times at school was a blast....rekindled many good memories.","Happy Birthday to Khaleesy ! Hope you liked the flowers babe, I'll see you when I get home ....expect the princess treatment !!! love you  xxxxx

You always say that my messages on here are too short so i'm making an effort to write you a longgggggggggggggggggg one this time hahaha

happy birthday to you, happy birthday to you, happy birthday Khaleesy, Happy Birthday too youuuuuuuuuuuuuu....uuuuuuuu xxxxx",High,"['IF a person expresses enthusiasm for meeting up with a group of friends and shows eagerness to organize future gatherings in a post, THEN extraversion is likely High because it indicates they enjoy socializing and are proactive in their relationships.', 'IF a person uses vivid and energetic language to describe a fun event with multiple friends and expresses excitement about the experience, THEN extraversion is likely High because it shows they derive joy and energy from social interactions.', 'IF a person reflects positively on shared memories with friends and expresses a desire to continue forming memories in the future, THEN extraversion is likely High because it suggests they are comfortable and engaged in social settings.', 'IF a person makes plans or expresses an eagerness to meet with friends in a social context and comments positively about shared experiences, THEN extraversion is likely High because it signifies a preference for social interaction over solitude.', 'IF a person expresses affection and personal connections in their messages and demonstrates enthusiasm when celebrating others, THEN extraversion is likely High because it indicates they thrive in social bonds.']","[""we mustn't leave it so long next time."", ""having a brill time at the reunion, saw lots of faces i've not seen in a longggggg time."", 'Talking about old times at school was a blast....rekindled many good memories.', 'just waiting for the karaoke to begin so i can impress everyone with a bit of Enrique!', ""Happy Birthday to Khaleesy ! Hope you liked the flowers babe, I'll see you when I get home ....expect the princess treatment !!! love you  xxxxx""]",High,"{'Sociability': 2, 'Positive Emotions': 1, 'Warmth': 1, 'Uncategorized': 1}",1
11,"Hey guys!!!
guess who we have here today???

My childhood friends came over. Oh my God, i have really missed them, i saw them last about 8 years ago but we've always been in communication. I'm so happy to see them and i can't wait to update you guys on the plans we have to catch up. 
Stay tuned!","Happy birthday to the love of my life. I can't imagine what my life could have been without you, you brought colors into my life. On this big day of yours, i wish you heavens choicest blessings and i pray all your hear desires are granted. I love you so much and i hope i make you happy as much as you make me",Low,"['IF a person expresses enthusiasm for meeting up with a group of friends and shows eagerness to organize future gatherings in a post, THEN extraversion is likely High because it indicates they enjoy socializing and are proactive in their relationships.', 'IF a person reflects positively on shared memories with friends and expresses a desire to continue forming memories in the future, THEN extraversion is likely High because it suggests they are comfortable and engaged in social settings.']","[""I'm so happy to see them and i can't wait to update you guys on the plans we have to catch up."", ""I have really missed them, i saw them last about 8 years ago but we've always been in communication.""]",High,"{'Sociability': 1, 'Warmth': 1}",0
12,"Had a great catch up with my old school pals. 
Dinner was lovely and lots of laughs and drinks as usual! Always great to see them and amazing that we are all still friends after over 30 years.
Can't wait until the next one in December . Hope everyone can make it as it's going to be a special trip!","Wishing you the happiest of birthdays. You deserve to have the best day!
Thanks for being the most amazing and supportive partner.
We all appreciate everything you do for us .
We hope you love your surprise party .. you won't read this until after , so it's safe to write this :-) Lots of love ...",Moderate,"['IF a person expresses enthusiasm for meeting up with a group of friends and shows eagerness to organize future gatherings in a post, THEN extraversion is likely High because it indicates they enjoy socializing and are proactive in their relationships.', 'IF a person uses vivid and energetic language to describe a fun event with multiple friends and expresses excitement about the experience, THEN extraversion is likely High because it shows they derive joy and energy from social interactions.', 'IF a person reflects positively on shared memories with friends and expresses a desire to continue forming memories in the future, THEN extraversion is likely High because it suggests they are comfortable and engaged in social settings.']","[""Can't wait until the next one in December."", 'Dinner was lovely and lots of laughs and drinks as usual!', 'Always great to see them and amazing that we are all still friends after over 30 years.']",High,"{'Sociability': 1, 'Positive Emotions': 1, 'Warmth': 1}",0
13,I hung out with my best friend when I was a teenager.   We were in San Diego in a rented condo.  We drank and danced to 80s music!  I kicked her butt in air hockey and we went to the zoo.  Shout out to Dassi.  I love you! Cant wait to do it again!  Let's go whale watching next time.,"Happy Birthday my Kub.  I love you so much and am praying that God blesses you with peace and happiness this year.  I know God is good, he brought me to you.   You are the best thing that has ever happened to me.  I pray for many more years together.  Love your Kewgar.  Happy Birthday my rub.",Moderate,"['IF a person expresses enthusiasm for meeting up with a group of friends and shows eagerness to organize future gatherings in a post, THEN extraversion is likely High because it indicates they enjoy socializing and are proactive in their relationships.', 'IF a person reflects positively on shared memories with friends and expresses a desire to continue forming memories in the future, THEN extraversion is likely High because it suggests they are comfortable and engaged in social settings.']","[""I kicked her butt in air hockey and we went to the zoo. Shout out to Dassi. I love you! Cant wait to do it again! Let's go whale watching next time."", 'I hung out with my best friend when I was a teenager. We were in San Diego in a rented condo.']",High,"{'Sociability': 1, 'Warmth': 1}",0
14,"Times Like This??Life can be complicated, but my people make it all worth it. My loved ones are what keep me going. Whether we go for drinks, go out to eat, or are just kicked back smoking and talking. I don't know where I would be without them. I'm so blessed to be able to call you guys my family. All glory to God.",HAPPY BIRTHDAY BABYGIRL????I am so proud of you for making it another year. Even when times are tough you always keep that spark. I love you so much. You really show me what real love is. I don't know where I'd be without you. Another year and forever to go for us baby. I love you so much and I'm so blessed to have you.,High,"['IF a person reflects positively on shared memories with friends and expresses a desire to continue forming memories in the future, THEN extraversion is likely High because it suggests they are comfortable and engaged in social settings.', 'IF a person mentions feeling nostalgic about past experiences with a close friend and does not express a strong desire to create new social experiences, THEN extraversion is likely Low because it indicates a preference for reminiscing rather than seeking out new social interactions.', 'IF a person describes interactions with a few chosen individuals and does not express enthusiasm or a desire to socialize with a broader group, THEN extraversion is likely Low because it suggests they are more comfortable or satisfied with intimate rather than wide-ranging social circles.']","['My loved ones are what keep me going. Whether we go for drinks, go out to eat, or are just kicked back smoking and talking.', ""I don't know where I would be without them. I'm so blessed to be able to call you guys my family."", ""I'm so blessed to have you.""]",Low,"{'Warmth': 1, 'Sociability': 2}",0
15,"Just got back from a reunion with some friends from back home! These guys always had my back, except when it comes to telling me I'm any good at bowling or mini golf :0 Then again, the drinks probably messed my aim up a litttle bit. Hope to see you guys soon!! Keep it real @xComedyCheesex @Crazygamer05 @7evenup","To this beautiful girl who was a stranger up until 10 months ago, happy birthday my love, I hope that we can spend many more together! P.S. Don't tell anyone I forgot the cake and had to ask you to bake us another one to save myself from the embarassment. Love you lots! Have the best birthday ever &lt;3",High,"['IF a person expresses enthusiasm for meeting up with a group of friends and shows eagerness to organize future gatherings in a post, THEN extraversion is likely High because it indicates they enjoy socializing and are proactive in their relationships.', 'IF a person reflects positively on shared memories with friends and expresses a desire to continue forming memories in the future, THEN extraversion is likely High because it suggests they are comfortable and engaged in social settings.', 'IF a person expresses an eagerness to meet with friends in a social context and comments positively about shared experiences, THEN extraversion is likely High because it signifies a preference for social interaction over solitude.']","['Hope to see you guys soon!!', 'Just got back from a reunion with some friends from back home! These guys always had my back...', 'Hope to see you guys soon!!']",High,"{'Sociability': 1, 'Warmth': 1, 'Uncategorized': 1}",1
