p,post1,post2,true_label,matched_rules,matched_behaviours,pred_rule_based,category_counts,score_rules
16,"went to a great birthday party today at the drummond park animal experience
centre with ash, jen, jodie jake, alex and all the rest of the crew.  loved watching the
monkeys antics.  the lion cubs were so cute.  alex ate too much cake and looked alittle
green jake punched him in the stomach to sicee if he could make him sick ..","wow!  another landmark birthday.  we are all so looking forward to your birthday
bash at Fisher's restaurant.  can't believe you've come this far despite all the
hoops you've had to jump through in the past few years,  what an achievement
well done you.  I know you said no presents but well suspect there may still be one or two surprises",Low,"['IF a person expresses enthusiasm for meeting up with a group of friends and shows eagerness to organize future gatherings in a post, THEN extraversion is likely High because it indicates they enjoy socializing and are proactive in their relationships.', 'IF a person uses vivid and energetic language to describe a fun event with multiple friends and expresses excitement about the experience, THEN extraversion is likely High because it shows they derive joy and energy from social interactions.', 'IF a person reflects positively on shared memories with friends and expresses a desire to continue forming memories in the future, THEN extraversion is likely High because it suggests they are comfortable and engaged in social settings.']","[""we are all so looking forward to your birthday bash at Fisher's restaurant."", 'went to a great birthday party today at the drummond park animal experience centre with ash, jen, jodie jake, alex and all the rest of the crew.', 'loved watching the monkeys antics.']",High,"{'Sociability': 1, 'Positive Emotions': 1, 'Warmth': 1}",0
17,"Finally! The stars aligned and we were able to go out together! What a wild time we've had, you would think that we were in 2004 living our best life at XXX university! The venue was just perfect, and by the look of the videos, despite turning 40 we can still bust a move like when we were 20! ","My darling partner, wishing you the best birthday ever (yet!). Just like fine wine you've aged amazingly well, the salt and pepper look really becomes you! I hope you will enjoy the celebrations we planned for you today, fear not we'll keep it low key and definitely not party like we did for your thirtieth!",High,"['IF a person expresses enthusiasm for meeting up with a group of friends and shows eagerness to organize future gatherings in a post, THEN extraversion is likely High because it indicates they enjoy socializing and are proactive in their relationships.', 'IF a person uses vivid and energetic language to describe a fun event with multiple friends and expresses excitement about the experience, THEN extraversion is likely High because it shows they derive joy and energy from social interactions.', 'IF a person makes plans or expresses an eagerness to meet with friends in a social context and comments positively about shared experiences, THEN extraversion is likely High because it signifies a preference for social interaction over solitude.']","[""Finally! The stars aligned and we were able to go out together! What a wild time we've had, you would think that we were in 2004 living our best life at XXX university!"", 'The venue was just perfect, and by the look of the videos, despite turning 40 we can still bust a move like when we were 20!', ""I hope you will enjoy the celebrations we planned for you today, fear not we'll keep it low key and definitely not party like we did for your thirtieth!""]",High,"{'Sociability': 2, 'Positive Emotions': 1}",1
18,"School reunion gathering, fun night with all. Lots of laughs and embarrassing stories which may or may not have been true. It was great to catch up with everyone again after so long. Let's not leave it so long next time. Here's to being not to old to dance the night away in true school disco style.","He has finally made it another year older. I don't know how he has reached this great milestone—happy Birthday to the three-score and ten-year-old man I love. It would not be your birthday without a post like this. Your turn next to embarrass me. Here to cake, fizz and a fun-filled day of surprises.",Low,"['IF a person expresses enthusiasm for meeting up with a group of friends and shows eagerness to organize future gatherings in a post, THEN extraversion is likely High because it indicates they enjoy socializing and are proactive in their relationships.', 'IF a person uses vivid and energetic language to describe a fun event with multiple friends and expresses excitement about the experience, THEN extraversion is likely High because it shows they derive joy and energy from social interactions.', 'IF a person makes plans or expresses an eagerness to meet with friends in a social context and comments positively about shared experiences, THEN extraversion is likely High because it signifies a preference for social interaction over solitude.']","[""It was great to catch up with everyone again after so long. Let's not leave it so long next time."", 'School reunion gathering, fun night with all. Lots of laughs and embarrassing stories.', ""Here's to being not too old to dance the night away in true school disco style.""]",High,"{'Sociability': 2, 'Positive Emotions': 1}",0
19,"So exciting to catch up with everyone! Being in our thirties means meeting up takes at least ten conversations about the event, at least one cancellation, minimum two babies and a stray husband. Glad this one made it out of the group chat. To next time; hopefully it doesn't take eight months ;)","Turning 30 has never looked better. Spending our twenties together was incredible; the highs, the lows, but most importantly being with you. So excited to spend the rest of my life with you. Happy birthday to the love of my life. You have changed my life in the most incredible way and you are so special to me. Cheers to my favourite person. I love you.",Moderate,"['IF a person expresses enthusiasm for meeting up with a group of friends and shows eagerness to organize future gatherings in a post, THEN extraversion is likely High because it indicates they enjoy socializing and are proactive in their relationships.', 'IF a person reflects positively on shared memories with friends and expresses a desire to continue forming memories in the future, THEN extraversion is likely High because it suggests they are comfortable and engaged in social settings.', 'IF a person makes plans or expresses an eagerness to meet with friends in a social context and comments positively about shared experiences, THEN extraversion is likely High because it signifies a preference for social interaction over solitude.']","[""So exciting to catch up with everyone! ... To next time; hopefully it doesn't take eight months ;)"", 'Spending our twenties together was incredible; the highs, the lows, but most importantly being with you.', 'So exciting to catch up with everyone!']",High,"{'Sociability': 2, 'Warmth': 1}",0
20,"Wow. Having a great time catching up with old childhood friends after over 50 years! We haven't changed a bit ????.  Other than having several marriages, 18 children and 7 grandchildren between us. Life has definitely been a journey and pretty good to all of us ??. Lets not leave it another 50 years to catch up ??",Happy Birthday to this amazing man who I'm so proud to call my husband and father of my chidren. Hope you have an absolutely brilliant day and so glad i get to share it with you. You're definitely like a fine wine and get better and better with each passing year. All my love forever and always ?,High,"['IF a person expresses enthusiasm for meeting up with a group of friends and shows eagerness to organize future gatherings in a post, THEN extraversion is likely High because it indicates they enjoy socializing and are proactive in their relationships.', 'IF a person reflects positively on shared memories with friends and expresses a desire to continue forming memories in the future, THEN extraversion is likely High because it suggests they are comfortable and engaged in social settings.', 'IF a person makes plans or expresses an eagerness to meet with friends in a social context and comments positively about shared experiences, THEN extraversion is likely High because it signifies a preference for social interaction over solitude.', 'IF a person uses vivid and energetic language to describe a fun event with multiple friends and expresses excitement about the experience, THEN extraversion is likely High because it shows they derive joy and energy from social interactions.', 'IF a person expresses joy in social interactions and pride in their relationships, THEN extraversion is likely High because it shows they value connections with others.']","['Lets not leave it another 50 years to catch up.', 'Having a great time catching up with old childhood friends after over 50 years!', ""We haven't changed a bit... Life has definitely been a journey and pretty good to all of us."", 'Wow. Having a great time catching up with old childhood friends after over 50 years!', ""Happy Birthday to this amazing man who I'm so proud to call my husband and father of my children.""]",High,"{'Sociability': 2, 'Warmth': 1, 'Positive Emotions': 1, 'Uncategorized': 1}",1
21,"Good times with old friends! Great catch up and a nostalgic trip down memory lane with childhood pals. Food, drinks, music, games and great chat! Venue was great too with great service, would highly recommend. Thanks to all for coming. Should make this a regular thing, so heres to the next one!","A very happy birthday to my incredible wife! you are the most loving, strong and inspirational person that i know, and i am privileged to have you in my life. Congratulations on all that you have achieved and your recent success, long may it continue. thanks for many memories and look forward to creating many more with you.",Low,"['IF a person expresses enthusiasm for meeting up with a group of friends and shows eagerness to organize future gatherings in a post, THEN extraversion is likely High because it indicates they enjoy socializing and are proactive in their relationships.', 'IF a person reflects positively on shared memories with friends and expresses a desire to continue forming memories in the future, THEN extraversion is likely High because it suggests they are comfortable and engaged in social settings.']","[""Should make this a regular thing, so here's to the next one!"", 'thanks for many memories and look forward to creating many more with you.']",High,"{'Sociability': 1, 'Warmth': 1}",0
22,"It had been a long time coming, I met my childhood friends after nearly 10 years. We certainly had plenty of banter and catch up talk to go through. It is amazing how we have all gone down different routes yet have had similar childhood experiences. It was also interesting how our personality traits are still noticeable from all that time ago. ",Happy Birthday! Many happy returns and I hope you have a wonderful dream fulled day! Looking forward to going out to celebrate your Birthday. Hope you liked all your presents. I am sure it will be a day to remember with all the celebrations. Love you loads and wishing you all the best. ,Low,"['IF a person reflects positively on shared memories with friends and expresses a desire to continue forming memories in the future, THEN extraversion is likely High because it suggests they are comfortable and engaged in social settings.', 'IF a person makes plans or expresses an eagerness to meet with friends in a social context and comments positively about shared experiences, THEN extraversion is likely High because it signifies a preference for social interaction over solitude.']","['It had been a long time coming, I met my childhood friends after nearly 10 years. We certainly had plenty of banter and catch up talk to go through.', 'Looking forward to going out to celebrate your Birthday. Hope you liked all your presents.']",Moderate,"{'Warmth': 1, 'Sociability': 1}",0
23,An unforgettable day with childhood friends! A magical day reminicising together and catching up after so long. Doesn’t matter how long it’s been we all slot back together like no time has passed at all. Watching our kids play together and seeing the cycles of life begin all over again is so emotional. Love you all xx #westhillgang #pyegreenmassive #childhood #friends,"Happy Birthday to my best friend, the best husband and dad in the world! I’ve celebrated 13 of your birthdays with you and every day in between and for all the chats and hugs, the love, the tough times, it is never ever enough. I look forward to seeing you every morning, I can’t wait to see you after work every day. The love of my life, I am so in love with you. Happy Birthday, my love xxx",Low,"['IF a person reflects positively on shared memories with friends and expresses a desire to continue forming memories in the future, THEN extraversion is likely High because it suggests they are comfortable and engaged in social settings.', 'IF a person mentions feeling nostalgic about past experiences with a close friend and does not express a strong desire to create new social experiences, THEN extraversion is likely Low because it indicates a preference for reminiscing rather than seeking out new social interactions.', 'IF a person reflects on their social interactions with a sense of obligation rather than joy, suggesting they find social environments draining, THEN extraversion is likely Low because it indicates a lack of enthusiasm for socializing.']","['An unforgettable day with childhood friends! A magical day reminicising together and catching up after so long.', 'Doesn’t matter how long it’s been we all slot back together like no time has passed at all.', 'it is never ever enough.']",Low,"{'Warmth': 1, 'Sociability': 1, 'Energy/Activity': 1}",1
24,"Had the best time ca tching up with my chilidhood friends last night! It’s amazing how, despite t he years, we fall riight back into those silly jokes and shared memories. From playing games in the backyard to reminis cing about our wild adventures, it was a great reminder of the b onds that shaped us","Happy Birtihday to the love of my life! i’m so grateful for every moment we share together. You bring so mucih joy and laughter into my world. I can’t wait to celebrate you today and make more amazinng memories! Here’s to another year of love, adventure, and all your dreams coming true. You deserve the best!",High,"['IF a person reflects positively on shared memories with friends and expresses a desire to continue forming memories in the future, THEN extraversion is likely High because it suggests they are comfortable and engaged in social settings.', 'IF a person makes plans or expresses an eagerness to meet with friends in a social context and comments positively about shared experiences, THEN extraversion is likely High because it signifies a preference for social interaction over solitude.']","[""It's amazing how, despite the years, we fall right back into those silly jokes and shared memories."", 'I can’t wait to celebrate you today and make more amazing memories!']",Moderate,"{'Warmth': 1, 'Sociability': 1}",0
25,"Was lucky enough to recently meet up and have an amazing time catching up with old friends from school who I hadn't seen in years, these are the people who made my childhood and shaped me into the person i am now so to see them all again and share memories was unbelievable, hopefully do it again soon","Happy birthday to my amazing partner, hope you have an fantastic day, thank you for everything you have done for me since the first moment I met you and putting up with me all the time, wishing you an amazing day and I've got a lot planned that will hopefully give you the day you deserve and to spoil you ",Moderate,"['IF a person expresses enthusiasm for meeting up with a group of friends and shows eagerness to organize future gatherings in a post, THEN extraversion is likely High because it indicates they enjoy socializing and are proactive in their relationships.', 'IF a person reflects positively on shared memories with friends and expresses a desire to continue forming memories in the future, THEN extraversion is likely High because it suggests they are comfortable and engaged in social settings.', 'IF a person makes plans or expresses an eagerness to meet with friends in a social context and comments positively about shared experiences, THEN extraversion is likely High because it signifies a preference for social interaction over solitude.']","['Was lucky enough to recently meet up and have an amazing time catching up with old friends from school... hopefully do it again soon.', 'these are the people who made my childhood and shaped me into the person i am now so to see them all again and share memories was unbelievable.', ""I've got a lot planned that will hopefully give you the day you deserve and to spoil you.""]",High,"{'Sociability': 2, 'Warmth': 1}",0
26,"Loved loved loved seeing these guys today…the original OG’s from way back when I still had a fringe, wore double denim and was reading Shout magazine. Wah life goes by so fast.
I’m so lucky to have these guys still in my life today, we need to make these meet ups a more regular thing!","Happy Birthday to our one and only, our jam in the sandwich… have the best day. Me and the boys will be on our best behaviour today so get some rest and do something you enjoy. We love you along with everyone else who knows you. Wishing you the best of health wealth and happiness.",High,"['IF a person expresses enthusiasm for meeting up with a group of friends and shows eagerness to organize future gatherings in a post, THEN extraversion is likely High because it indicates they enjoy socializing and are proactive in their relationships.', 'IF a person reflects positively on shared memories with friends and expresses a desire to continue forming memories in the future, THEN extraversion is likely High because it suggests they are comfortable and engaged in social settings.', 'IF a person makes plans or expresses an eagerness to meet with friends in a social context and comments positively about shared experiences, THEN extraversion is likely High because it signifies a preference for social interaction over solitude.']","['we need to make these meet ups a more regular thing!', 'Loved loved loved seeing these guys today…the original OG’s from way back when', 'Me and the boys will be on our best behaviour today']",High,"{'Sociability': 2, 'Warmth': 1}",1
27,"After all these years it's very interesting seeing how everyone I grew up with has changed, it's almost as if I was talking to two different versions of people from parallel universes, one a complete immature and incompetent buffon, the other a sophisticated and well mannered individual. It's crazy how time flies!","From cheerleader to married, I'm so appreciative of all the things you have done for me, and our family. Helping us financially or help cope with illness, I knew I made the right decision engaging with a nurse.I'm so glad that you came into my life and that we'll one day exit together. Happy 26th birthday my love!",Low,"['IF a person reflects positively on shared memories with friends and expresses a desire to continue forming memories in the future, THEN extraversion is likely High because it suggests they are comfortable and engaged in social settings.', 'IF a person mentions feeling nostalgic about past experiences with a close friend and does not express a strong desire to create new social experiences, THEN extraversion is likely Low because it indicates a preference for reminiscing rather than seeking out new social interactions.', 'IF a person reflects on their social interactions with a sense of obligation rather than joy, suggesting they find social environments draining, THEN extraversion is likely Low because it indicates a lack of enthusiasm for socializing.']","[""After all these years it's very interesting seeing how everyone I grew up with has changed..."", ""it's almost as if I was talking to two different versions of people from parallel universes, one a complete immature and incompetent buffon, the other a sophisticated and well mannered individual."", 'Helping us financially or help cope with illness, I knew I made the right decision engaging with a nurse.']",Low,"{'Warmth': 1, 'Sociability': 1, 'Energy/Activity': 1}",1
28,My oldest and dearest friends gathered at the weekend to celebrate 30 years since leaving school. Much laughing and getting over how much we had all aged. Looking back at our old school photos was hilarious. Some of us didn't even recognise ourselves. We had such a good time that we decided to make this an annual event ,The most important person in my life achieves a milestone birthday today. Congratulations on your 50th and may we share many more happy years together. Unfortunately it's all downhill from here. Buckle up for the coming mid life crisis and keep smiling. These can be the best years of life with the right attitude. Get writing that bucket list and let's see the world ticking them off.,Low,"['IF a person expresses enthusiasm for meeting up with a group of friends and shows eagerness to organize future gatherings in a post, THEN extraversion is likely High because it indicates they enjoy socializing and are proactive in their relationships.', 'IF a person reflects positively on shared memories with friends and expresses a desire to continue forming memories in the future, THEN extraversion is likely High because it suggests they are comfortable and engaged in social settings.', 'IF a person makes plans or expresses an eagerness to meet with friends in a social context and comments positively about shared experiences, THEN extraversion is likely High because it signifies a preference for social interaction over solitude.']","['We had such a good time that we decided to make this an annual event.', 'Much laughing and getting over how much we had all aged. Looking back at our old school photos was hilarious.', ""Let's see the world ticking them off.""]",High,"{'Sociability': 2, 'Warmth': 1}",0
29,"After all this time , the 5 of us still have our meet ups!  We just carry on chatting as though  we met yesterday and it's not just a yearly event. Great friends,  really lucky to be still in touch .
Luckily we're all in Good health... apart from a few old age creaks and cracks.
Already planned next year venue.","Well the next year is upon us! Yep you're having another birthday... watch out for an influx of children later , and be prepared for a lot of noise.
Just because you're a year older,  doesn't mean you can get a quiet life!
Glad you're my husband...
Happy birthday xxxx  and many more  to come xxxx",Moderate,"['IF a person expresses enthusiasm for meeting up with a group of friends and shows eagerness to organize future gatherings in a post, THEN extraversion is likely High because it indicates they enjoy socializing and are proactive in their relationships.', 'IF a person reflects positively on shared memories with friends and expresses a desire to continue forming memories in the future, THEN extraversion is likely High because it suggests they are comfortable and engaged in social settings.', 'IF a person makes plans or expresses an eagerness to meet with friends in a social context and comments positively about shared experiences, THEN extraversion is likely High because it signifies a preference for social interaction over solitude.', 'IF a person uses vivid and energetic language to describe a fun event with multiple friends and expresses excitement about the experience, THEN extraversion is likely High because it shows they derive joy and energy from social interactions.']","['After all this time, the 5 of us still have our meet ups!', ""We just carry on chatting as though we met yesterday and it's not just a yearly event."", 'Already planned next year venue.', ""Well the next year is upon us! Yep you're having another birthday... watch out for an influx of children later, and be prepared for a lot of noise.""]",High,"{'Sociability': 2, 'Warmth': 1, 'Positive Emotions': 1}",0
